[PIPELINE] → watch: since_hours=24.0 top_k=10 min_score=0.3
[watch-import] [INFO] Started watch. since_hours=24.0 (→ days=1.00) top_k=10 min_score=0.3
[watch-import] [HF] daily fetched=5 from date/2025-11-24
[watch-import] [HF] weekly fetched=15 from week/2025-W48
[watch-import] [HF] monthly fetched=50 from month/2025-11
[watch-import] [INFO] Building library index for dedupe...
[watch-import] [INFO] Library index sizes: DOI=76 arXiv=871 URL=1046 TY=1055
[watch-import] [TAG] embodied_ai 'embodied_ai｜具身智能' keywords=5
[watch-import] [HF] embodied_ai matched 1 trending papers.
[watch-import] [HF-OVERRIDE] Added 'PhysX-Anything: Simulation-Ready Physical 3D Assets from Single Image' despite score=0.01
[watch-import] [SCORE] tag=embodied_ai total=1 selected=1
[watch-import] [COL] ensured collection 'embodied_ai｜具身智能' → X496QMJ5
[watch-import] [SKIP] duplicate PhysX-Anything: Simulation-Ready Physical 3D Assets from Single Image (arxiv:2511.13648)
[watch-import] [TAG] sim2real 'sim2real｜模拟到现实' keywords=5
[watch-import] [SCORE] tag=sim2real total=0 selected=0
[watch-import] [TAG] teleoperation 'teleoperation｜遥操作' keywords=5
[watch-import] [SCORE] tag=teleoperation total=0 selected=0
[watch-import] [TAG] robotic_navigation 'robotic_navigation｜机器人导航' keywords=5
[watch-import] [HF] robotic_navigation matched 4 trending papers.
[watch-import] [HF-OVERRIDE] Added 'IterResearch: Rethinking Long-Horizon Agents via Markovian State
[watch-import]   Reconstructio' despite score=0.17
[watch-import] [HF-OVERRIDE] Added 'π_RL: Online RL Fine-tuning for Flow-based
[watch-import]   Vision-Language-Action Models' despite score=0.11
[watch-import] [SCORE] tag=robotic_navigation total=4 selected=4
[watch-import] [COL] ensured collection 'robotic_navigation｜机器人导航' → MCGEU54N
[watch-import] [SKIP] duplicate Thinking with Video: Video Generation as a Promising Multimodal
[watch-import]   Reasoning Para (arxiv:2511.04570)
[watch-import] [SKIP] duplicate Lumine: An Open Recipe for Building Generalist Agents in 3D Open Worlds (arxiv:2511.08892)
[watch-import] [SKIP] duplicate IterResearch: Rethinking Long-Horizon Agents via Markovian State
[watch-import]   Reconstructio (arxiv:2511.07327)
[watch-import] [SKIP] duplicate π_RL: Online RL Fine-tuning for Flow-based
[watch-import]   Vision-Language-Action Models (arxiv:2510.25889)
[watch-import] [TAG] robotic_manipulation 'robotic_manipulation｜机器人操作' keywords=5
[watch-import] [HF] robotic_manipulation matched 7 trending papers.
[watch-import] [HF-OVERRIDE] Added 'GeoVista: Web-Augmented Agentic Visual Reasoning for Geolocalization' despite score=0.30
[watch-import] [HF-OVERRIDE] Added 'Mantis: A Versatile Vision-Language-Action Model with Disentangled Visual Foresi' despite score=0.24
[watch-import] [SCORE] tag=robotic_manipulation total=7 selected=3
[watch-import] [COL] ensured collection 'robotic_manipulation｜机器人操作' → VPMXKEIX
[watch-import] [SKIP] duplicate Lumine: An Open Recipe for Building Generalist Agents in 3D Open Worlds (arxiv:2511.08892)
[watch-import] [SKIP] duplicate GeoVista: Web-Augmented Agentic Visual Reasoning for Geolocalization (arxiv:2511.15705)
[watch-import] [ADD] Mantis: A Versatile Vision-Language-Action Model with Disentangled Visual Foresi → robotic_manipulation｜机器人操作 [9764MTSR]
[watch-import] [ATTACH] PDF linked for 9764MTSR
[watch-import] [TAG] robotic_grasping 'robotic_grasping｜机器人抓取' keywords=5
[watch-import] [SCORE] tag=robotic_grasping total=0 selected=0
[watch-import] [TAG] vision_language_model 'vision_language_model｜视觉语言模型' keywords=5
[watch-import] [HF] vision_language_model matched 20 trending papers.
[watch-import] [HF-OVERRIDE] Added 'VIDEOP2R: Video Understanding from Perception to Reasoning' despite score=0.29
[watch-import] [HF-OVERRIDE] Added 'VCode: a Multimodal Coding Benchmark with SVG as Symbolic Visual
[watch-import]   Representatio' despite score=0.28
[watch-import] [SCORE] tag=vision_language_model total=20 selected=4
[watch-import] [COL] ensured collection 'vision_language_model｜视觉语言模型' → QVF9KXGQ
[watch-import] [SKIP] duplicate Thinking with Video: Video Generation as a Promising Multimodal
[watch-import]   Reasoning Para (arxiv:2511.04570)
[watch-import] [SKIP] duplicate Lumine: An Open Recipe for Building Generalist Agents in 3D Open Worlds (arxiv:2511.08892)
[watch-import] [SKIP] duplicate VIDEOP2R: Video Understanding from Perception to Reasoning (arxiv:2511.11113)
[watch-import] [SKIP] duplicate VCode: a Multimodal Coding Benchmark with SVG as Symbolic Visual
[watch-import]   Representatio (arxiv:2511.02778)
[watch-import] [TAG] vision_language_action_model 'vision_language_action_model｜视觉语言动作模型' keywords=4
[watch-import] [HF] vision_language_action_model matched 8 trending papers.
[watch-import] [HF-OVERRIDE] Added 'RynnVLA-002: A Unified Vision-Language-Action and World Model' despite score=0.25
[watch-import] [HF-OVERRIDE] Added 'Mantis: A Versatile Vision-Language-Action Model with Disentangled Visual Foresi' despite score=0.24
[watch-import] [SCORE] tag=vision_language_action_model total=8 selected=2
[watch-import] [COL] ensured collection 'vision_language_action_model｜视觉语言动作模型' → QXJMF6GC
[watch-import] [SKIP] duplicate RynnVLA-002: A Unified Vision-Language-Action and World Model (arxiv:2511.17502)
[watch-import] [SKIP] duplicate Mantis: A Versatile Vision-Language-Action Model with Disentangled Visual Foresi (arxiv:2511.16175)
[watch-import] [TAG] large_language_model 'large_language_model｜大语言模型' keywords=4
[watch-import] [HF] large_language_model matched 23 trending papers.
[watch-import] [HF-OVERRIDE] Added 'VIDEOP2R: Video Understanding from Perception to Reasoning' despite score=0.29
[watch-import] [HF-OVERRIDE] Added 'Think-at-Hard: Selective Latent Iterations to Improve Reasoning Language Models' despite score=0.25
[watch-import] [SCORE] tag=large_language_model total=23 selected=6
[watch-import] [COL] ensured collection 'large_language_model｜大语言模型' → 2M7PTRS5
[watch-import] [SKIP] duplicate Thinking with Video: Video Generation as a Promising Multimodal
[watch-import]   Reasoning Para (arxiv:2511.04570)
[watch-import] [SKIP] duplicate MiroThinker: Pushing the Performance Boundaries of Open-Source Research Agents v (arxiv:2511.11793)
[watch-import] [SKIP] duplicate P1: Mastering Physics Olympiads with Reinforcement Learning (arxiv:2511.13612)
[watch-import] [SKIP] duplicate Souper-Model: How Simple Arithmetic Unlocks State-of-the-Art LLM Performance (arxiv:2511.13254)
[watch-import] [SKIP] duplicate VIDEOP2R: Video Understanding from Perception to Reasoning (arxiv:2511.11113)
[watch-import] [SKIP] duplicate Think-at-Hard: Selective Latent Iterations to Improve Reasoning Language Models (arxiv:2511.08577)
[watch-import] [TAG] foundation_model 'foundation_model｜基础模型' keywords=4
[watch-import] [HF] foundation_model matched 1 trending papers.
[watch-import] [SCORE] tag=foundation_model total=1 selected=1
[watch-import] [COL] ensured collection 'foundation_model｜基础模型' → XHCMX3G4
[watch-import] [SKIP] duplicate Kandinsky 5.0: A Family of Foundation Models for Image and Video Generation (arxiv:2511.14993)
[watch-import] [TAG] dexterous_hand 'dexterous_hand｜灵巧机械手' keywords=4
[watch-import] [SCORE] tag=dexterous_hand total=0 selected=0
[watch-import] [TAG] humanoid_robot 'humanoid_robot｜类人机器人' keywords=4
[watch-import] [SCORE] tag=humanoid_robot total=0 selected=0
[watch-import] [TAG] quadruped_robot 'quadruped_robot｜四足机器人' keywords=3
[watch-import] [SCORE] tag=quadruped_robot total=0 selected=0
[watch-import] [TAG] robotic_arm 'robotic_arm｜机械臂' keywords=3
[watch-import] [SCORE] tag=robotic_arm total=0 selected=0
[watch-import] [TAG] reinforcement_learning 'reinforcement_learning｜强化学习' keywords=4
[watch-import] [HF] reinforcement_learning matched 48 trending papers.
[watch-import] [HF-OVERRIDE] Added 'GeoVista: Web-Augmented Agentic Visual Reasoning for Geolocalization' despite score=0.30
[watch-import] [HF-OVERRIDE] Added 'One Small Step in Latent, One Giant Leap for Pixels: Fast Latent Upscale Adapter' despite score=0.30
[watch-import] [SCORE] tag=reinforcement_learning total=48 selected=9
[watch-import] [COL] ensured collection 'reinforcement_learning｜强化学习' → 8S3SWIMS
[watch-import] [SKIP] duplicate OpenMMReasoner: Pushing the Frontiers for Multimodal Reasoning with an Open and  (arxiv:2511.16334)
[watch-import] [SKIP] duplicate Kandinsky 5.0: A Family of Foundation Models for Image and Video Generation (arxiv:2511.14993)
[watch-import] [SKIP] duplicate Lumine: An Open Recipe for Building Generalist Agents in 3D Open Worlds (arxiv:2511.08892)
[watch-import] [SKIP] duplicate MiroThinker: Pushing the Performance Boundaries of Open-Source Research Agents v (arxiv:2511.11793)
[watch-import] [SKIP] duplicate P1: Mastering Physics Olympiads with Reinforcement Learning (arxiv:2511.13612)
[watch-import] [SKIP] duplicate Diffusion Language Models are Super Data Learners (arxiv:2511.03276)
[watch-import] [SKIP] duplicate Tiny Model, Big Logic: Diversity-Driven Optimization Elicits Large-Model
[watch-import]   Reaso (arxiv:2511.06221)
[watch-import] [SKIP] duplicate GeoVista: Web-Augmented Agentic Visual Reasoning for Geolocalization (arxiv:2511.15705)
[watch-import] [SKIP] duplicate One Small Step in Latent, One Giant Leap for Pixels: Fast Latent Upscale Adapter (arxiv:2511.10629)
[watch-import] [TAG] imitation_learning 'imitation_learning｜模仿学习' keywords=5
[watch-import] [HF] imitation_learning matched 1 trending papers.
[watch-import] [HF-OVERRIDE] Added 'EBT-Policy: Energy Unlocks Emergent Physical Reasoning Capabilities' despite score=0.01
[watch-import] [SCORE] tag=imitation_learning total=1 selected=1
[watch-import] [COL] ensured collection 'imitation_learning｜模仿学习' → GMS5HD3W
[watch-import] [SKIP] duplicate EBT-Policy: Energy Unlocks Emergent Physical Reasoning Capabilities (arxiv:2510.27545)
[watch-import] [TAG] world_model 'world_model｜世界模型' keywords=4
[watch-import] [HF] world_model matched 3 trending papers.
[watch-import] [HF-OVERRIDE] Added 'RynnVLA-002: A Unified Vision-Language-Action and World Model' despite score=0.25
[watch-import] [HF-OVERRIDE] Added 'PAN: A World Model for General, Interactable, and Long-Horizon World Simulation' despite score=0.13
[watch-import] [SCORE] tag=world_model total=3 selected=2
[watch-import] [COL] ensured collection 'world_model｜世界模型' → 4R62EWKD
[watch-import] [SKIP] duplicate RynnVLA-002: A Unified Vision-Language-Action and World Model (arxiv:2511.17502)
[watch-import] [SKIP] duplicate PAN: A World Model for General, Interactable, and Long-Horizon World Simulation (arxiv:2511.09057)
[watch-import] [TAG] simulator 'simulator｜仿真平台' keywords=5
[watch-import] [HF] simulator matched 1 trending papers.
[watch-import] [HF-OVERRIDE] Added 'PhysX-Anything: Simulation-Ready Physical 3D Assets from Single Image' despite score=0.01
[watch-import] [SCORE] tag=simulator total=1 selected=1
[watch-import] [COL] ensured collection 'simulator｜仿真平台' → KNGFHIMG
[watch-import] [SKIP] duplicate PhysX-Anything: Simulation-Ready Physical 3D Assets from Single Image (arxiv:2511.13648)
[watch-import] [TAG] motion_planning 'motion_planning｜运动规划' keywords=4
[watch-import] [HF] motion_planning matched 1 trending papers.
[watch-import] [HF-OVERRIDE] Added 'Planning with Sketch-Guided Verification for Physics-Aware Video Generation' despite score=0.14
[watch-import] [SCORE] tag=motion_planning total=1 selected=1
[watch-import] [COL] ensured collection 'motion_planning｜运动规划' → DGH39V7J
[watch-import] [SKIP] duplicate Planning with Sketch-Guided Verification for Physics-Aware Video Generation (arxiv:2511.17450)
[watch-import] [TAG] task_planning 'task_planning｜任务规划' keywords=4
[watch-import] [HF] task_planning matched 2 trending papers.
[watch-import] [HF-OVERRIDE] Added 'Grounding Computer Use Agents on Human Demonstrations' despite score=0.28
[watch-import] [HF-OVERRIDE] Added 'Part-X-MLLM: Part-aware 3D Multimodal Large Language Model' despite score=0.14
[watch-import] [SCORE] tag=task_planning total=2 selected=2
[watch-import] [COL] ensured collection 'task_planning｜任务规划' → IDXJKRDJ
[watch-import] [SKIP] duplicate Grounding Computer Use Agents on Human Demonstrations (arxiv:2511.07332)
[watch-import] [SKIP] duplicate Part-X-MLLM: Part-aware 3D Multimodal Large Language Model (arxiv:2511.13647)
[watch-import] [TAG] code_based_task_planning 'code_based_task_planning｜代码任务规划' keywords=4
[watch-import] [SCORE] tag=code_based_task_planning total=0 selected=0
[watch-import] [TAG] language_based_task_planning 'language_based_task_planning｜语言任务规划' keywords=3
[watch-import] [SCORE] tag=language_based_task_planning total=0 selected=0
[watch-import] [TAG] end_to_end_task_planning 'end_to_end_task_planning｜端到端任务规划' keywords=3
[watch-import] [SCORE] tag=end_to_end_task_planning total=0 selected=0
[watch-import] [TAG] grounded_task_planning 'grounded_task_planning｜具身语义任务规划' keywords=3
[watch-import] [SCORE] tag=grounded_task_planning total=0 selected=0
[watch-import] [TAG] transformer_policy 'transformer_policy｜Transformer控制策略' keywords=4
[watch-import] [SCORE] tag=transformer_policy total=0 selected=0
[watch-import] [TAG] diffusion_policy 'diffusion_policy｜扩散策略学习' keywords=3
[watch-import] [HF] diffusion_policy matched 1 trending papers.
[watch-import] [HF-OVERRIDE] Added 'EBT-Policy: Energy Unlocks Emergent Physical Reasoning Capabilities' despite score=0.01
[watch-import] [SCORE] tag=diffusion_policy total=1 selected=1
[watch-import] [COL] ensured collection 'diffusion_policy｜扩散策略学习' → 8MXTUFIM
[watch-import] [SKIP] duplicate EBT-Policy: Energy Unlocks Emergent Physical Reasoning Capabilities (arxiv:2510.27545)
[watch-import] [TAG] 3d_vision '3d_vision｜3D视觉感知' keywords=4
[watch-import] [SCORE] tag=3d_vision total=0 selected=0
[watch-import] [TAG] point_based_action 'point_based_action｜基于点的控制' keywords=4
[watch-import] [SCORE] tag=point_based_action total=0 selected=0
[watch-import] [TAG] chain_of_thought 'chain_of_thought｜链式推理' keywords=4
[watch-import] [SCORE] tag=chain_of_thought total=0 selected=0
[watch-import] [INFO] Recorded 1 new items → /Users/neoone/code/Zotero/.data/new_items_watch.json
[watch-import] [INFO] Done. Summary: {"candidates": 1, "added": 1, "skipped": 37, "updated": 0, "hf_candidates": 121, "hf_overrides": 21}
[watch-import] [INFO] Report → /Users/neoone/code/Zotero/reports/watch_20251124_140734.json
[PIPELINE] ✓ watch completed
[PIPELINE] → pdf: since_hours=24.0 limit=∞
[fetch-pdfs] [TRY] 9764MTSR ← existing attachment link: https://arxiv.org/pdf/2511.16175.pdf
[fetch-pdfs] [OK] Linked local PDF for 9764MTSR
[fetch-pdfs] [INFO] Item 97PVT295 already has local PDF attachments; skipping.
[fetch-pdfs] [INFO] Item V3HMDV78 already has local PDF attachments; skipping.
[fetch-pdfs] [INFO] Item 35ZM9RFG already has local PDF attachments; skipping.
[fetch-pdfs] [INFO] Item C72TI3ZW already has local PDF attachments; skipping.
[fetch-pdfs] [INFO] Item WAU82RT2 already has local PDF attachments; skipping.
[fetch-pdfs] [INFO] Item 69ATCVDT already has local PDF attachments; skipping.
[fetch-pdfs] [INFO] Item 26CN8BVS already has local PDF attachments; skipping.
[fetch-pdfs] [INFO] Item EFKT82XE already has local PDF attachments; skipping.
[fetch-pdfs] [INFO] Item AH8QACXH already has local PDF attachments; skipping.
[fetch-pdfs] [INFO] Item P8H545S2 already has local PDF attachments; skipping.
[fetch-pdfs] [INFO] Item VN3DW7Q8 already has local PDF attachments; skipping.
[fetch-pdfs] [INFO] Item A5PX2MMK already has local PDF attachments; skipping.
[fetch-pdfs] [INFO] Item J5V6X8MF already has local PDF attachments; skipping.
[fetch-pdfs] [INFO] Item ZN49V5A5 already has local PDF attachments; skipping.
[fetch-pdfs] [INFO] Item RK65A6Z6 already has local PDF attachments; skipping.
[fetch-pdfs] [INFO] Item XHX55AGZ already has local PDF attachments; skipping.
[fetch-pdfs] [INFO] Item 9USJC8CE already has local PDF attachments; skipping.
[fetch-pdfs] [INFO] Item QFGAKAFR already has local PDF attachments; skipping.
[fetch-pdfs] [INFO] Item EP8H4VXE already has local PDF attachments; skipping.
[fetch-pdfs] [INFO] Item IKUXQGNW already has local PDF attachments; skipping.
[fetch-pdfs] [INFO] Item VUCMZQQP already has local PDF attachments; skipping.
[fetch-pdfs] [INFO] Item RCFME4I3 already has local PDF attachments; skipping.
[fetch-pdfs] [INFO] Item VEUBCGZ8 already has local PDF attachments; skipping.
[fetch-pdfs] [INFO] Item 3XF77G5E already has local PDF attachments; skipping.
[fetch-pdfs] [INFO] Completed. PDFs added: 1, remaining without PDF: 0.
[PIPELINE] ✓ pdf completed
[PIPELINE] → dedupe: limit=∞ since_hours=24.0
[dedupe] [INFO] Scanned 25 top-level items (after time filter).
[dedupe] [INFO] No duplicates detected with the current heuristic.
[PIPELINE] ✓ dedupe completed
[PIPELINE] → summary: limit=200 since_hours=24.0
[summaries] [INFO] Fetched 200 Zotero items before time-window filtering.
[summaries] [INFO] 105 items remain after applying modified-since 24.0h window.
[summaries] [INFO] Processing Mantis__A_Versatile_Vision-Language-Action_Model_with_Disentangled_Visual_Foresi.pdf (UK2HDSS7)
[summaries]   - Reading Mantis__A_Versatile_Vision-Language-Action_Model_with_Disentangled_Visual_Foresi.pdf
[summaries]     [OK] Note created.
[summaries] [INFO] Processing PDF (Z78WDIJG)
[summaries]     [SKIP] Existing AI总结 note found; skipping this item.
[summaries] [INFO] Processing Mantis: A Versatile Vision-Language-Action Model with Disentangled Visual Foresight (9764MTSR)
[summaries]     [SKIP] Existing AI总结 note found; skipping this item.
[summaries] [INFO] Processing EA4H5U5P (EA4H5U5P)
[summaries] [WARN] No local PDF attachments for EA4H5U5P; children types: none
[summaries] [INFO] Processing KC432HQS (KC432HQS)
[summaries] [WARN] No local PDF attachments for KC432HQS; children types: none
[summaries] [INFO] Processing KESAUBQJ (KESAUBQJ)
[summaries] [WARN] No local PDF attachments for KESAUBQJ; children types: none
[summaries] [INFO] Processing STHZTGD2 (STHZTGD2)
[summaries] [WARN] No local PDF attachments for STHZTGD2; children types: none
[summaries] [INFO] Processing HCPPHNTZ (HCPPHNTZ)
[summaries] [WARN] No local PDF attachments for HCPPHNTZ; children types: none
[summaries] [INFO] Processing TST9Z48R (TST9Z48R)
[summaries] [WARN] No local PDF attachments for TST9Z48R; children types: none
[summaries] [INFO] Processing WJR9FQMJ (WJR9FQMJ)
[summaries] [WARN] No local PDF attachments for WJR9FQMJ; children types: none
[summaries] [INFO] Processing 8VN29QWX (8VN29QWX)
[summaries] [WARN] No local PDF attachments for 8VN29QWX; children types: none
[summaries] [INFO] Processing 86AFH7ZM (86AFH7ZM)
[summaries] [WARN] No local PDF attachments for 86AFH7ZM; children types: none
[summaries] [INFO] Processing PS9AEPCG (PS9AEPCG)
[summaries] [WARN] No local PDF attachments for PS9AEPCG; children types: none
[summaries] [INFO] Processing N4TN9AG7 (N4TN9AG7)
[summaries] [WARN] No local PDF attachments for N4TN9AG7; children types: none
[summaries] [INFO] Processing BJXSMWVH (BJXSMWVH)
[summaries] [WARN] No local PDF attachments for BJXSMWVH; children types: none
[summaries] [INFO] Processing DF9XZMKE (DF9XZMKE)
[summaries] [WARN] No local PDF attachments for DF9XZMKE; children types: none
[summaries] [INFO] Processing DGWQP3PT (DGWQP3PT)
[summaries] [WARN] No local PDF attachments for DGWQP3PT; children types: none
[summaries] [INFO] Processing T4U4ZU4C (T4U4ZU4C)
[summaries] [WARN] No local PDF attachments for T4U4ZU4C; children types: none
[summaries] [INFO] Processing 76TP3I7F (76TP3I7F)
[summaries] [WARN] No local PDF attachments for 76TP3I7F; children types: none
[summaries] [INFO] Processing 7E42V3MR (7E42V3MR)
[summaries] [WARN] No local PDF attachments for 7E42V3MR; children types: none
[summaries] [INFO] Processing FFQUVCFK (FFQUVCFK)
[summaries] [WARN] No local PDF attachments for FFQUVCFK; children types: none
[summaries] [INFO] Processing CDEEPEJM (CDEEPEJM)
[summaries] [WARN] No local PDF attachments for CDEEPEJM; children types: none
[summaries] [INFO] Processing SUGNCBPJ (SUGNCBPJ)
[summaries] [WARN] No local PDF attachments for SUGNCBPJ; children types: none
[summaries] [INFO] Processing 87N5NVSP (87N5NVSP)
[summaries] [WARN] No local PDF attachments for 87N5NVSP; children types: none
[summaries] [INFO] Processing FADASXXI (FADASXXI)
[summaries] [WARN] No local PDF attachments for FADASXXI; children types: none
[summaries] [INFO] Processing VJHUG3WW (VJHUG3WW)
[summaries] [WARN] No local PDF attachments for VJHUG3WW; children types: none
[summaries] [INFO] Processing NFDSVWJI (NFDSVWJI)
[summaries] [WARN] No local PDF attachments for NFDSVWJI; children types: none
[summaries] [INFO] Processing EGKRMGCN (EGKRMGCN)
[summaries] [WARN] No local PDF attachments for EGKRMGCN; children types: none
[summaries] [INFO] Processing FM6H3PER (FM6H3PER)
[summaries] [WARN] No local PDF attachments for FM6H3PER; children types: none
[summaries] [INFO] Processing GM2A33MK (GM2A33MK)
[summaries] [WARN] No local PDF attachments for GM2A33MK; children types: none
[summaries] [INFO] Processing Thinking_with_Video__Video_Generation_as_a_Promising_Multimodal___Reasoning_Para.pdf (TNEKHDTJ)
[summaries]     [SKIP] Existing AI总结 note found; skipping this item.
[summaries] [INFO] Processing Lumine__An_Open_Recipe_for_Building_Generalist_Agents_in_3D_Open_Worlds.pdf (HPHF6JQD)
[summaries]     [SKIP] Existing AI总结 note found; skipping this item.
[summaries] [INFO] Processing IterResearch__Rethinking_Long-Horizon_Agents_via_Markovian_State___Reconstructio.pdf (8DHKPM44)
[summaries]     [SKIP] Existing AI总结 note found; skipping this item.
[summaries] [INFO] Processing __RL__Online_RL_Fine-tuning_for_Flow-based___Vision-Language-Action_Models.pdf (TBFSSCFK)
[summaries]     [SKIP] Existing AI总结 note found; skipping this item.
[summaries] [INFO] Processing VLA-4D__Embedding_4D_Awareness_into_Vision-Language-Action_Models_for_SpatioTemp.pdf (CEAQKAM5)
[summaries]     [SKIP] Existing AI总结 note found; skipping this item.
[summaries] [INFO] Processing VCode__a_Multimodal_Coding_Benchmark_with_SVG_as_Symbolic_Visual___Representatio.pdf (DZS9RVV6)
[summaries]     [SKIP] Existing AI总结 note found; skipping this item.
[summaries] [INFO] Processing Don_t_Blind_Your_VLA__Aligning_Visual_Representations_for_OOD___Generalization.pdf (MQ5C2C3E)
[summaries]     [SKIP] Existing AI总结 note found; skipping this item.
[summaries] [INFO] Processing MiroThinker__Pushing_the_Performance_Boundaries_of_Open-Source_Research_Agents_v.pdf (JJ27ARFM)
[summaries]     [SKIP] Existing AI总结 note found; skipping this item.
[summaries] [INFO] Processing Souper-Model__How_Simple_Arithmetic_Unlocks_State-of-the-Art_LLM_Performance.pdf (JAFP62I4)
[summaries]     [SKIP] Existing AI总结 note found; skipping this item.
[summaries] [INFO] Processing WorldGen__From_Text_to_Traversable_and_Interactive_3D_Worlds.pdf (D6UU63N8)
[summaries]     [SKIP] Existing AI总结 note found; skipping this item.
[summaries] [INFO] Processing Kandinsky_5.0__A_Family_of_Foundation_Models_for_Image_and_Video_Generation.pdf (ZFXCB9BJ)
[summaries]     [SKIP] Existing AI总结 note found; skipping this item.
[summaries] [INFO] Processing Diffusion_Language_Models_are_Super_Data_Learners.pdf (E7J3XTVB)
[summaries]     [SKIP] Existing AI总结 note found; skipping this item.
[summaries] [INFO] Processing OpenMMReasoner__Pushing_the_Frontiers_for_Multimodal_Reasoning_with_an_Open_and_.pdf (FV48ZF6V)
[summaries]     [SKIP] Existing AI总结 note found; skipping this item.
[summaries] [INFO] Processing Tiny_Model__Big_Logic__Diversity-Driven_Optimization_Elicits_Large-Model___Reaso.pdf (IEZZCMZA)
[summaries]     [SKIP] Existing AI总结 note found; skipping this item.
[summaries] [INFO] Processing One_Small_Step_in_Latent__One_Giant_Leap_for_Pixels__Fast_Latent_Upscale_Adapter.pdf (CMEE5GFH)
[summaries]     [SKIP] Existing AI总结 note found; skipping this item.
[summaries] [INFO] Processing EBT-Policy__Energy_Unlocks_Emergent_Physical_Reasoning_Capabilities.pdf (IJV2X5ZD)
[summaries]     [SKIP] Existing AI总结 note found; skipping this item.
[summaries] [INFO] Processing PAN__A_World_Model_for_General__Interactable__and_Long-Horizon_World_Simulation.pdf (7TW9P7MN)
[summaries]     [SKIP] Existing AI总结 note found; skipping this item.
[summaries] [INFO] Processing Planning_with_Sketch-Guided_Verification_for_Physics-Aware_Video_Generation.pdf (IXGDZHNG)
[summaries]     [SKIP] Existing AI总结 note found; skipping this item.
[summaries] [INFO] Processing Grounding_Computer_Use_Agents_on_Human_Demonstrations.pdf (M6RWEP4J)
[summaries]     [SKIP] Existing AI总结 note found; skipping this item.
[summaries] [INFO] Processing Part-X-MLLM__Part-aware_3D_Multimodal_Large_Language_Model.pdf (WPXUHKQV)
[summaries]     [SKIP] Existing AI总结 note found; skipping this item.
[summaries] [INFO] Processing EBT-Policy__Energy_Unlocks_Emergent_Physical_Reasoning_Capabilities.pdf (W5I9XXGV)
[summaries]     [SKIP] Existing AI总结 note found; skipping this item.
[summaries] [INFO] Processing Think-at-Hard__Selective_Latent_Iterations_to_Improve_Reasoning_Language_Models.pdf (X4H5RQ4F)
[summaries]     [SKIP] Existing AI总结 note found; skipping this item.
[summaries] [INFO] Processing RynnVLA-002__A_Unified_Vision-Language-Action_and_World_Model.pdf (VBAUMDKX)
[summaries]     [SKIP] Existing AI总结 note found; skipping this item.
[summaries] [INFO] Processing ThinkMorph__Emergent_Properties_in_Multimodal_Interleaved___Chain-of-Thought_Rea.pdf (BDKDRUDG)
[summaries]     [SKIP] Existing AI总结 note found; skipping this item.
[summaries] [INFO] Processing PDF (XE4QUCHN)
[summaries]     [SKIP] Existing AI总结 note found; skipping this item.
[summaries] [INFO] Processing Think-at-Hard: Selective Latent Iterations to Improve Reasoning Language Models (97PVT295)
[summaries]     [SKIP] Existing AI总结 note found; skipping this item.
[summaries] [INFO] Processing PDF (FN7BWRCV)
[summaries]     [SKIP] Existing AI总结 note found; skipping this item.
[summaries] [INFO] Processing RynnVLA-002: A Unified Vision-Language-Action and World Model (V3HMDV78)
[summaries]     [SKIP] Existing AI总结 note found; skipping this item.
[summaries] [INFO] Processing PDF (RNRSX2RD)
[summaries]     [SKIP] Existing AI总结 note found; skipping this item.
[summaries] [INFO] Processing ThinkMorph: Emergent Properties in Multimodal Interleaved
[summaries]   Chain-of-Thought Reasoning (35ZM9RFG)
[summaries]     [SKIP] Existing AI总结 note found; skipping this item.
[summaries] [INFO] Processing PDF (EHZZNE9A)
[summaries]     [SKIP] Existing AI总结 note found; skipping this item.
[summaries] [INFO] Processing EBT-Policy: Energy Unlocks Emergent Physical Reasoning Capabilities (C72TI3ZW)
[summaries]     [SKIP] Existing AI总结 note found; skipping this item.
[summaries] [INFO] Processing PDF (RV7EHANM)
[summaries]     [SKIP] Existing AI总结 note found; skipping this item.
[summaries] [INFO] Processing Part-X-MLLM: Part-aware 3D Multimodal Large Language Model (WAU82RT2)
[summaries]     [SKIP] Existing AI总结 note found; skipping this item.
[summaries] [INFO] Processing PDF (NRBBHX7H)
[summaries]     [SKIP] Existing AI总结 note found; skipping this item.
[summaries] [INFO] Processing Grounding Computer Use Agents on Human Demonstrations (69ATCVDT)
[summaries]     [SKIP] Existing AI总结 note found; skipping this item.
[summaries] [INFO] Processing PDF (4EF52EID)
[summaries]     [SKIP] Existing AI总结 note found; skipping this item.
[summaries] [INFO] Processing Planning with Sketch-Guided Verification for Physics-Aware Video Generation (26CN8BVS)
[summaries]     [SKIP] Existing AI总结 note found; skipping this item.
[summaries] [INFO] Processing PDF (DT59T5T6)
[summaries]     [SKIP] Existing AI总结 note found; skipping this item.
[summaries] [INFO] Processing PAN: A World Model for General, Interactable, and Long-Horizon World Simulation (EFKT82XE)
[summaries]     [SKIP] Existing AI总结 note found; skipping this item.
[summaries] [INFO] Processing PDF (QV2EEHE8)
[summaries]     [SKIP] Existing AI总结 note found; skipping this item.
[summaries] [INFO] Processing EBT-Policy: Energy Unlocks Emergent Physical Reasoning Capabilities (AH8QACXH)
[summaries]     [SKIP] Existing AI总结 note found; skipping this item.
[summaries] [INFO] Processing PDF (DAX6MQHS)
[summaries]     [SKIP] Existing AI总结 note found; skipping this item.
[summaries] [INFO] Processing One Small Step in Latent, One Giant Leap for Pixels: Fast Latent Upscale Adapter for Your Diffusion Models (P8H545S2)
[summaries]     [SKIP] Existing AI总结 note found; skipping this item.
[summaries] [INFO] Processing PDF (X2N75FAK)
[summaries]     [SKIP] Existing AI总结 note found; skipping this item.
[summaries] [INFO] Processing Tiny Model, Big Logic: Diversity-Driven Optimization Elicits Large-Model
[summaries]   Reasoning Ability in VibeThinker-1.5B (VN3DW7Q8)
[summaries]     [SKIP] Existing AI总结 note found; skipping this item.
[summaries] [INFO] Processing PDF (C9QHKANZ)
[summaries]     [SKIP] Existing AI总结 note found; skipping this item.
[summaries] [INFO] Processing OpenMMReasoner: Pushing the Frontiers for Multimodal Reasoning with an Open and General Recipe (A5PX2MMK)
[summaries]     [SKIP] Existing AI总结 note found; skipping this item.
[summaries] [INFO] Processing PDF (BRK9ECCJ)
[summaries]     [SKIP] Existing AI总结 note found; skipping this item.
[summaries] [INFO] Processing Diffusion Language Models are Super Data Learners (J5V6X8MF)
[summaries]     [SKIP] Existing AI总结 note found; skipping this item.
[summaries] [INFO] Processing PDF (9KWV7SMG)
[summaries]     [SKIP] Existing AI总结 note found; skipping this item.
[summaries] [INFO] Processing Kandinsky 5.0: A Family of Foundation Models for Image and Video Generation (ZN49V5A5)
[summaries]     [SKIP] Existing AI总结 note found; skipping this item.
[summaries] [INFO] Processing PDF (MNQK4EIJ)
[summaries]     [SKIP] Existing AI总结 note found; skipping this item.
[summaries] [INFO] Processing WorldGen: From Text to Traversable and Interactive 3D Worlds (RK65A6Z6)
[summaries]     [SKIP] Existing AI总结 note found; skipping this item.
[summaries] [INFO] Processing PDF (UXNNV9AZ)
[summaries]     [SKIP] Existing AI总结 note found; skipping this item.
[summaries] [INFO] Processing Souper-Model: How Simple Arithmetic Unlocks State-of-the-Art LLM Performance (XHX55AGZ)
[summaries]     [SKIP] Existing AI总结 note found; skipping this item.
[summaries] [INFO] Processing PDF (QEMSHKJN)
[summaries]     [SKIP] Existing AI总结 note found; skipping this item.
[summaries] [INFO] Processing MiroThinker: Pushing the Performance Boundaries of Open-Source Research Agents via Model, Context, and Interactive Scaling (9USJC8CE)
[summaries]     [SKIP] Existing AI总结 note found; skipping this item.
[summaries] [INFO] Processing PDF (A8NMWZR8)
[summaries]     [SKIP] Existing AI总结 note found; skipping this item.
[summaries] [INFO] Processing Don't Blind Your VLA: Aligning Visual Representations for OOD
[summaries]   Generalization (QFGAKAFR)
[summaries]     [SKIP] Existing AI总结 note found; skipping this item.
[summaries] [INFO] Processing PDF (GADNJNWE)
[summaries]     [SKIP] Existing AI总结 note found; skipping this item.
[summaries] [INFO] Processing VCode: a Multimodal Coding Benchmark with SVG as Symbolic Visual
[summaries]   Representation (EP8H4VXE)
[summaries]     [SKIP] Existing AI总结 note found; skipping this item.
[summaries] [INFO] Processing PDF (4X3F5RER)
[summaries]     [SKIP] Existing AI总结 note found; skipping this item.
[summaries] [INFO] Processing VLA-4D: Embedding 4D Awareness into Vision-Language-Action Models for SpatioTemporally Coherent Robotic Manipulation (IKUXQGNW)
[summaries]     [SKIP] Existing AI总结 note found; skipping this item.
[summaries] [INFO] Processing PDF (CPDQCVQA)
[summaries]     [SKIP] Existing AI总结 note found; skipping this item.
[summaries] [INFO] Processing π_RL: Online RL Fine-tuning for Flow-based
[summaries]   Vision-Language-Action Models (VUCMZQQP)
[summaries]     [SKIP] Existing AI总结 note found; skipping this item.
[summaries] [INFO] Processing PDF (9VX28P3S)
[summaries]     [SKIP] Existing AI总结 note found; skipping this item.
[summaries] [INFO] Processing IterResearch: Rethinking Long-Horizon Agents via Markovian State
[summaries]   Reconstruction (RCFME4I3)
[summaries]     [SKIP] Existing AI总结 note found; skipping this item.
[summaries] [INFO] Processing PDF (BPQ69WPG)
[summaries]     [SKIP] Existing AI总结 note found; skipping this item.
[summaries] [INFO] Processing Lumine: An Open Recipe for Building Generalist Agents in 3D Open Worlds (VEUBCGZ8)
[summaries]     [SKIP] Existing AI总结 note found; skipping this item.
[summaries] [INFO] Processing PDF (HA6UUVSI)
[summaries]     [SKIP] Existing AI总结 note found; skipping this item.
[summaries] [INFO] Processing Thinking with Video: Video Generation as a Promising Multimodal
[summaries]   Reasoning Paradigm (3XF77G5E)
[summaries]     [SKIP] Existing AI总结 note found; skipping this item.
[summaries] [INFO] Processing Preprint PDF (ZVB73J5N)
[summaries]     [SKIP] Existing AI总结 note found; skipping this item.
[summaries] [INFO] Processing Preprint PDF (X9FBSMRM)
[summaries]     [SKIP] Existing AI总结 note found; skipping this item.
[summaries] [INFO] Processing Preprint PDF (CI7JVJI2)
[summaries]     [SKIP] Existing AI总结 note found; skipping this item.
[summaries] [INFO] Completed. Items scanned: 105, notes created: 1.
[PIPELINE] ✓ summary completed
[PIPELINE] → abstracts: limit=∞ since_hours=24.0
[abstracts] [INFO] Completed. Items scanned: 1103, updated: 0, missing abstract after lookup: 0.
[PIPELINE] ✓ abstracts completed
[PIPELINE] → notion: limit=500 since_hours=24.0
[notion-sync] [ERR] Notion API error for 'Mantis: A Versatile Vision-Language-Action Model with Disentangled Visual Foresi': 400 Client Error: Bad Request for url: https://api.notion.com/v1/pages
[notion-sync] [ERR] Notion API error for 'Think-at-Hard: Selective Latent Iterations to Improve Reasoning Language Models': 400 Client Error: Bad Request for url: https://api.notion.com/v1/pages/2b56ce10-e4b9-81ab-8d24-e332f29e64ba
[notion-sync] [ERR] Notion API error for 'RynnVLA-002: A Unified Vision-Language-Action and World Model': 400 Client Error: Bad Request for url: https://api.notion.com/v1/pages/2b56ce10-e4b9-81e7-ada9-d8ecec9255e4
[notion-sync] [ERR] Notion API error for 'ThinkMorph: Emergent Properties in Multimodal Interleaved
[notion-sync]   Chain-of-Thought Rea': 400 Client Error: Bad Request for url: https://api.notion.com/v1/pages/2b56ce10-e4b9-81d6-bd52-e96b77cb3bd8
[notion-sync] [ERR] Notion API error for 'EBT-Policy: Energy Unlocks Emergent Physical Reasoning Capabilities': 400 Client Error: Bad Request for url: https://api.notion.com/v1/pages/2b56ce10-e4b9-81d6-a48f-d7f5f4144d4d
[notion-sync] [ERR] Notion API error for 'Part-X-MLLM: Part-aware 3D Multimodal Large Language Model': 400 Client Error: Bad Request for url: https://api.notion.com/v1/pages/2b56ce10-e4b9-81bb-9ae1-ff06e77d830a
[notion-sync] [ERR] Notion API error for 'Grounding Computer Use Agents on Human Demonstrations': 400 Client Error: Bad Request for url: https://api.notion.com/v1/pages/2b56ce10-e4b9-8101-9482-c983d020e9a6
[notion-sync] [ERR] Notion API error for 'Planning with Sketch-Guided Verification for Physics-Aware Video Generation': 400 Client Error: Bad Request for url: https://api.notion.com/v1/pages/2b56ce10-e4b9-817d-9c59-fc4fecb3abfb
[notion-sync] [ERR] Notion API error for 'PAN: A World Model for General, Interactable, and Long-Horizon World Simulation': 400 Client Error: Bad Request for url: https://api.notion.com/v1/pages/2b56ce10-e4b9-819c-9eeb-eeec641d2a32
[notion-sync] [ERR] Notion API error for 'EBT-Policy: Energy Unlocks Emergent Physical Reasoning Capabilities': 400 Client Error: Bad Request for url: https://api.notion.com/v1/pages/2b56ce10-e4b9-81d6-a48f-d7f5f4144d4d
[notion-sync] [ERR] Notion API error for 'One Small Step in Latent, One Giant Leap for Pixels: Fast Latent Upscale Adapter': 400 Client Error: Bad Request for url: https://api.notion.com/v1/pages/2b56ce10-e4b9-81c7-8b4d-d2afa02cbedd
[notion-sync] [ERR] Notion API error for 'Tiny Model, Big Logic: Diversity-Driven Optimization Elicits Large-Model
[notion-sync]   Reaso': 400 Client Error: Bad Request for url: https://api.notion.com/v1/pages/2b56ce10-e4b9-8116-80f0-f919ca4cf533
[notion-sync] [ERR] Notion API error for 'OpenMMReasoner: Pushing the Frontiers for Multimodal Reasoning with an Open and ': 400 Client Error: Bad Request for url: https://api.notion.com/v1/pages/2b56ce10-e4b9-8174-aefe-fba196877522
[notion-sync] [ERR] Notion API error for 'Diffusion Language Models are Super Data Learners': 400 Client Error: Bad Request for url: https://api.notion.com/v1/pages/2b56ce10-e4b9-8110-9211-ffe8ffbf9660
[notion-sync] [ERR] Notion API error for 'Kandinsky 5.0: A Family of Foundation Models for Image and Video Generation': 400 Client Error: Bad Request for url: https://api.notion.com/v1/pages/2b56ce10-e4b9-8148-b8a3-f6ff1f964f86
[notion-sync] [ERR] Notion API error for 'WorldGen: From Text to Traversable and Interactive 3D Worlds': 400 Client Error: Bad Request for url: https://api.notion.com/v1/pages/2b56ce10-e4b9-8107-a86a-d2229cae885b
[notion-sync] [ERR] Notion API error for 'Souper-Model: How Simple Arithmetic Unlocks State-of-the-Art LLM Performance': 400 Client Error: Bad Request for url: https://api.notion.com/v1/pages/2b56ce10-e4b9-81b9-b2d0-d854f425e7db
[notion-sync] [ERR] Notion API error for 'MiroThinker: Pushing the Performance Boundaries of Open-Source Research Agents v': 400 Client Error: Bad Request for url: https://api.notion.com/v1/pages/2b56ce10-e4b9-8183-a12f-f18dbfe690ea
[notion-sync] [ERR] Notion API error for 'Don't Blind Your VLA: Aligning Visual Representations for OOD
[notion-sync]   Generalization': 400 Client Error: Bad Request for url: https://api.notion.com/v1/pages/2b56ce10-e4b9-818b-99ba-f688638760ba
[notion-sync] [ERR] Notion API error for 'VCode: a Multimodal Coding Benchmark with SVG as Symbolic Visual
[notion-sync]   Representatio': 400 Client Error: Bad Request for url: https://api.notion.com/v1/pages/2b56ce10-e4b9-8196-ad43-e1aa07f122f7
[notion-sync] [ERR] Notion API error for 'VLA-4D: Embedding 4D Awareness into Vision-Language-Action Models for SpatioTemp': 400 Client Error: Bad Request for url: https://api.notion.com/v1/pages/2b56ce10-e4b9-8159-8b00-dc3e371e2535
[notion-sync] [ERR] Notion API error for 'π_RL: Online RL Fine-tuning for Flow-based
[notion-sync]   Vision-Language-Action Models': 400 Client Error: Bad Request for url: https://api.notion.com/v1/pages/2b56ce10-e4b9-81d4-bd05-c15a103ca1a7
[notion-sync] [ERR] Notion API error for 'IterResearch: Rethinking Long-Horizon Agents via Markovian State
[notion-sync]   Reconstructio': 400 Client Error: Bad Request for url: https://api.notion.com/v1/pages/2b56ce10-e4b9-8152-83d1-d356c1664255
[notion-sync] [ERR] Notion API error for 'Lumine: An Open Recipe for Building Generalist Agents in 3D Open Worlds': 400 Client Error: Bad Request for url: https://api.notion.com/v1/pages/2b56ce10-e4b9-8137-a848-dc84c8e050b4
[notion-sync] [ERR] Notion API error for 'Thinking with Video: Video Generation as a Promising Multimodal
[notion-sync]   Reasoning Para': 400 Client Error: Bad Request for url: https://api.notion.com/v1/pages/2b56ce10-e4b9-81b7-903e-cb9a14b6355b
[notion-sync] [INFO] Completed. Scanned=25 created=0 updated=0
[PIPELINE] ✓ notion completed
{
  "watch": {
    "name": "watch-import",
    "command": [
      "/Users/neoone/miniconda3/bin/python",
      "/Users/neoone/code/Zotero/scripts/watch_and_import_papers.py",
      "--tags",
      "/Users/neoone/code/Zotero/tag.json",
      "--since-days",
      "0",
      "--since-hours",
      "24.0",
      "--top-k",
      "10",
      "--min-score",
      "0.3",
      "--log-file",
      "/Users/neoone/code/Zotero/logs/watch_20251124_140734.log",
      "--report-json",
      "/Users/neoone/code/Zotero/reports/watch_20251124_140734.json",
      "--create-collections"
    ],
    "artifacts": {
      "log": "/Users/neoone/code/Zotero/logs/watch_20251124_140734.log",
      "report": "/Users/neoone/code/Zotero/reports/watch_20251124_140734.json",
      "report_data": {
        "started_at": "2025-11-24T14:07:34.621549",
        "params": {
          "since_days": 0,
          "since_hours": 24.0,
          "top_k": 10,
          "min_score": 0.3,
          "create_collections": true,
          "fill_missing": false,
          "dry_run": false,
          "use_hf_papers": true,
          "hf_weight": 0.3
        },
        "tags": {
          "embodied_ai": {
            "label": "embodied_ai｜具身智能",
            "candidates": 1,
            "added": 0,
            "skipped": 1,
            "updated": 0,
            "hf_candidates": 1,
            "hf_overrides": 1
          },
          "sim2real": {
            "label": "sim2real｜模拟到现实",
            "candidates": 0,
            "added": 0,
            "skipped": 0,
            "updated": 0,
            "hf_candidates": 0,
            "hf_overrides": 0
          },
          "teleoperation": {
            "label": "teleoperation｜遥操作",
            "candidates": 0,
            "added": 0,
            "skipped": 0,
            "updated": 0,
            "hf_candidates": 0,
            "hf_overrides": 0
          },
          "robotic_navigation": {
            "label": "robotic_navigation｜机器人导航",
            "candidates": 4,
            "added": 0,
            "skipped": 4,
            "updated": 0,
            "hf_candidates": 4,
            "hf_overrides": 2
          },
          "robotic_manipulation": {
            "label": "robotic_manipulation｜机器人操作",
            "candidates": 7,
            "added": 1,
            "skipped": 2,
            "updated": 0,
            "hf_candidates": 7,
            "hf_overrides": 2
          },
          "robotic_grasping": {
            "label": "robotic_grasping｜机器人抓取",
            "candidates": 0,
            "added": 0,
            "skipped": 0,
            "updated": 0,
            "hf_candidates": 0,
            "hf_overrides": 0
          },
          "vision_language_model": {
            "label": "vision_language_model｜视觉语言模型",
            "candidates": 20,
            "added": 0,
            "skipped": 4,
            "updated": 0,
            "hf_candidates": 20,
            "hf_overrides": 2
          },
          "vision_language_action_model": {
            "label": "vision_language_action_model｜视觉语言动作模型",
            "candidates": 8,
            "added": 0,
            "skipped": 2,
            "updated": 0,
            "hf_candidates": 8,
            "hf_overrides": 2
          },
          "large_language_model": {
            "label": "large_language_model｜大语言模型",
            "candidates": 23,
            "added": 0,
            "skipped": 6,
            "updated": 0,
            "hf_candidates": 23,
            "hf_overrides": 2
          },
          "foundation_model": {
            "label": "foundation_model｜基础模型",
            "candidates": 1,
            "added": 0,
            "skipped": 1,
            "updated": 0,
            "hf_candidates": 1,
            "hf_overrides": 0
          },
          "dexterous_hand": {
            "label": "dexterous_hand｜灵巧机械手",
            "candidates": 0,
            "added": 0,
            "skipped": 0,
            "updated": 0,
            "hf_candidates": 0,
            "hf_overrides": 0
          },
          "humanoid_robot": {
            "label": "humanoid_robot｜类人机器人",
            "candidates": 0,
            "added": 0,
            "skipped": 0,
            "updated": 0,
            "hf_candidates": 0,
            "hf_overrides": 0
          },
          "quadruped_robot": {
            "label": "quadruped_robot｜四足机器人",
            "candidates": 0,
            "added": 0,
            "skipped": 0,
            "updated": 0,
            "hf_candidates": 0,
            "hf_overrides": 0
          },
          "robotic_arm": {
            "label": "robotic_arm｜机械臂",
            "candidates": 0,
            "added": 0,
            "skipped": 0,
            "updated": 0,
            "hf_candidates": 0,
            "hf_overrides": 0
          },
          "reinforcement_learning": {
            "label": "reinforcement_learning｜强化学习",
            "candidates": 48,
            "added": 0,
            "skipped": 9,
            "updated": 0,
            "hf_candidates": 48,
            "hf_overrides": 2
          },
          "imitation_learning": {
            "label": "imitation_learning｜模仿学习",
            "candidates": 1,
            "added": 0,
            "skipped": 1,
            "updated": 0,
            "hf_candidates": 1,
            "hf_overrides": 1
          },
          "world_model": {
            "label": "world_model｜世界模型",
            "candidates": 3,
            "added": 0,
            "skipped": 2,
            "updated": 0,
            "hf_candidates": 3,
            "hf_overrides": 2
          },
          "simulator": {
            "label": "simulator｜仿真平台",
            "candidates": 1,
            "added": 0,
            "skipped": 1,
            "updated": 0,
            "hf_candidates": 1,
            "hf_overrides": 1
          },
          "motion_planning": {
            "label": "motion_planning｜运动规划",
            "candidates": 1,
            "added": 0,
            "skipped": 1,
            "updated": 0,
            "hf_candidates": 1,
            "hf_overrides": 1
          },
          "task_planning": {
            "label": "task_planning｜任务规划",
            "candidates": 2,
            "added": 0,
            "skipped": 2,
            "updated": 0,
            "hf_candidates": 2,
            "hf_overrides": 2
          },
          "code_based_task_planning": {
            "label": "code_based_task_planning｜代码任务规划",
            "candidates": 0,
            "added": 0,
            "skipped": 0,
            "updated": 0,
            "hf_candidates": 0,
            "hf_overrides": 0
          },
          "language_based_task_planning": {
            "label": "language_based_task_planning｜语言任务规划",
            "candidates": 0,
            "added": 0,
            "skipped": 0,
            "updated": 0,
            "hf_candidates": 0,
            "hf_overrides": 0
          },
          "end_to_end_task_planning": {
            "label": "end_to_end_task_planning｜端到端任务规划",
            "candidates": 0,
            "added": 0,
            "skipped": 0,
            "updated": 0,
            "hf_candidates": 0,
            "hf_overrides": 0
          },
          "grounded_task_planning": {
            "label": "grounded_task_planning｜具身语义任务规划",
            "candidates": 0,
            "added": 0,
            "skipped": 0,
            "updated": 0,
            "hf_candidates": 0,
            "hf_overrides": 0
          },
          "transformer_policy": {
            "label": "transformer_policy｜Transformer控制策略",
            "candidates": 0,
            "added": 0,
            "skipped": 0,
            "updated": 0,
            "hf_candidates": 0,
            "hf_overrides": 0
          },
          "diffusion_policy": {
            "label": "diffusion_policy｜扩散策略学习",
            "candidates": 1,
            "added": 0,
            "skipped": 1,
            "updated": 0,
            "hf_candidates": 1,
            "hf_overrides": 1
          },
          "3d_vision": {
            "label": "3d_vision｜3D视觉感知",
            "candidates": 0,
            "added": 0,
            "skipped": 0,
            "updated": 0,
            "hf_candidates": 0,
            "hf_overrides": 0
          },
          "point_based_action": {
            "label": "point_based_action｜基于点的控制",
            "candidates": 0,
            "added": 0,
            "skipped": 0,
            "updated": 0,
            "hf_candidates": 0,
            "hf_overrides": 0
          },
          "chain_of_thought": {
            "label": "chain_of_thought｜链式推理",
            "candidates": 0,
            "added": 0,
            "skipped": 0,
            "updated": 0,
            "hf_candidates": 0,
            "hf_overrides": 0
          }
        },
        "summary": {
          "candidates": 1,
          "added": 1,
          "skipped": 37,
          "updated": 0,
          "hf_candidates": 121,
          "hf_overrides": 21
        },
        "errors": [],
        "hf_sources": {
          "daily": 5,
          "weekly": 15,
          "monthly": 50
        },
        "finished_at": "2025-11-24T14:15:36.361211"
      }
    }
  },
  "pdf": {
    "name": "fetch-pdfs",
    "command": [
      "/Users/neoone/miniconda3/bin/python",
      "/Users/neoone/code/Zotero/scripts/fetch_missing_pdfs.py",
      "--since-hours",
      "24.0",
      "--new-items-json",
      "/Users/neoone/code/Zotero/.data/new_items_watch.json"
    ],
    "artifacts": {}
  },
  "dedupe": {
    "name": "dedupe",
    "command": [
      "/Users/neoone/miniconda3/bin/python",
      "/Users/neoone/code/Zotero/scripts/merge_zotero_duplicates.py",
      "--group-by",
      "auto",
      "--modified-since-hours",
      "24.0"
    ],
    "artifacts": {}
  },
  "summary": {
    "name": "summaries",
    "command": [
      "/Users/neoone/miniconda3/bin/python",
      "/Users/neoone/code/Zotero/scripts/summarize_zotero_with_doubao.py",
      "--limit",
      "200",
      "--max-pages",
      "80",
      "--max-chars",
      "80000",
      "--note-tag",
      "AI总结",
      "--summary-dir",
      "/Users/neoone/code/Zotero/summaries",
      "--recursive",
      "--insert-note",
      "--model",
      "qwen3-max",
      "--modified-since-hours",
      "24.0"
    ],
    "artifacts": {
      "summary_dir": "/Users/neoone/code/Zotero/summaries"
    }
  },
  "abstract": {
    "name": "abstracts",
    "command": [
      "/Users/neoone/miniconda3/bin/python",
      "/Users/neoone/code/Zotero/scripts/enrich_zotero_abstracts.py",
      "--modified-since-hours",
      "24.0"
    ],
    "artifacts": {}
  },
  "notion": {
    "name": "notion-sync",
    "command": [
      "/Users/neoone/miniconda3/bin/python",
      "/Users/neoone/code/Zotero/scripts/sync_zotero_to_notion.py",
      "--limit",
      "500",
      "--tag-file",
      "/Users/neoone/code/Zotero/tag.json",
      "--recursive",
      "--skip-untitled",
      "--enrich-with-doubao",
      "--since-hours",
      "24.0"
    ],
    "artifacts": {}
  }
}
