[PIPELINE] → watch: since_hours=24.0 top_k=10 min_score=0.3
[watch-import] [INFO] Started watch. since_hours=24.0 (→ days=1.00) top_k=10 min_score=0.3
[watch-import] [HF] daily fetched=3 from date/2025-12-22
[watch-import] [HF] weekly fetched=3 from week/2025-W52
[watch-import] [HF] monthly fetched=50 from month/2025-12
[watch-import] [INFO] Building library index for dedupe...
[watch-import] [INFO] Library index sizes: DOI=101 arXiv=1160 URL=1402 TY=1379
[watch-import] [TAG] embodied_ai 'embodied_ai｜具身智能' keywords=5
[watch-import] [SCORE] tag=embodied_ai total=0 selected=0
[watch-import] [TAG] embodied_surveys 'embodied_surveys｜具身智能综述' keywords=9
[watch-import] [HF] embodied_surveys matched 7 trending papers.
[watch-import] [HF-OVERRIDE] Added 'Memory in the Age of AI Agents' despite score=0.27
[watch-import] [HF-OVERRIDE] Added 'Adaptation of Agentic AI' despite score=0.22
[watch-import] [SCORE] tag=embodied_surveys total=7 selected=2
[watch-import] [COL] ensured collection 'embodied_surveys｜具身智能综述' → DMRQPHFK
[watch-import] [SKIP] duplicate Memory in the Age of AI Agents (arxiv:2512.13564)
[watch-import] [ADD] Adaptation of Agentic AI → embodied_surveys｜具身智能综述 [QRQ3QTIJ]
[watch-import] [ATTACH] PDF linked for QRQ3QTIJ
[watch-import] [TAG] sim2real 'sim2real｜模拟到现实' keywords=5
[watch-import] [SCORE] tag=sim2real total=0 selected=0
[watch-import] [TAG] teleoperation 'teleoperation｜遥操作' keywords=5
[watch-import] [SCORE] tag=teleoperation total=0 selected=0
[watch-import] [TAG] robotic_navigation 'robotic_navigation｜机器人导航' keywords=5
[watch-import] [HF] robotic_navigation matched 1 trending papers.
[watch-import] [HF-OVERRIDE] Added 'QwenLong-L1.5: Post-Training Recipe for Long-Context Reasoning and Memory Manage' despite score=0.25
[watch-import] [SCORE] tag=robotic_navigation total=1 selected=1
[watch-import] [COL] ensured collection 'robotic_navigation｜机器人导航' → MCGEU54N
[watch-import] [SKIP] duplicate QwenLong-L1.5: Post-Training Recipe for Long-Context Reasoning and Memory Manage (arxiv:2512.12967)
[watch-import] [TAG] robotic_manipulation 'robotic_manipulation｜机器人操作' keywords=5
[watch-import] [HF] robotic_manipulation matched 2 trending papers.
[watch-import] [HF-OVERRIDE] Added 'Skywork-R1V4: Toward Agentic Multimodal Intelligence through Interleaved Thinkin' despite score=0.07
[watch-import] [HF-OVERRIDE] Added 'REASONEDIT: Towards Reasoning-Enhanced Image Editing Models' despite score=0.04
[watch-import] [SCORE] tag=robotic_manipulation total=2 selected=2
[watch-import] [COL] ensured collection 'robotic_manipulation｜机器人操作' → VPMXKEIX
[watch-import] [SKIP] duplicate Skywork-R1V4: Toward Agentic Multimodal Intelligence through Interleaved Thinkin (arxiv:2512.02395)
[watch-import] [SKIP] duplicate REASONEDIT: Towards Reasoning-Enhanced Image Editing Models (arxiv:2511.22625)
[watch-import] [TAG] robotic_grasping 'robotic_grasping｜机器人抓取' keywords=5
[watch-import] [SCORE] tag=robotic_grasping total=0 selected=0
[watch-import] [TAG] vision_language_model 'vision_language_model｜视觉语言模型' keywords=5
[watch-import] [HF] vision_language_model matched 4 trending papers.
[watch-import] [HF-OVERRIDE] Added 'Video Reality Test: Can AI-Generated ASMR Videos fool VLMs and Humans?' despite score=0.13
[watch-import] [HF-OVERRIDE] Added 'What about gravity in video generation? Post-Training Newton's Laws with Verifia' despite score=0.08
[watch-import] [SCORE] tag=vision_language_model total=4 selected=3
[watch-import] [COL] ensured collection 'vision_language_model｜视觉语言模型' → QVF9KXGQ
[watch-import] [SKIP] duplicate Qwen3-VL Technical Report (arxiv:2511.21631)
[watch-import] [SKIP] duplicate Video Reality Test: Can AI-Generated ASMR Videos fool VLMs and Humans? (arxiv:2512.13281)
[watch-import] [SKIP] duplicate What about gravity in video generation? Post-Training Newton's Laws with Verifia (arxiv:2512.00425)
[watch-import] [TAG] vision_language_action_model 'vision_language_action_model｜视觉语言动作模型' keywords=4
[watch-import] [SCORE] tag=vision_language_action_model total=0 selected=0
[watch-import] [TAG] large_language_model 'large_language_model｜大语言模型' keywords=4
[watch-import] [HF] large_language_model matched 24 trending papers.
[watch-import] [HF-OVERRIDE] Added '4D-RGPT: Toward Region-level 4D Understanding via Perceptual Distillation' despite score=0.30
[watch-import] [HF-OVERRIDE] Added 'Step-GUI Technical Report' despite score=0.29
[watch-import] [SCORE] tag=large_language_model total=24 selected=6
[watch-import] [COL] ensured collection 'large_language_model｜大语言模型' → 2M7PTRS5
[watch-import] [ADD] Seed-Prover 1.5: Mastering Undergraduate-Level Theorem Proving via Learning from → large_language_model｜大语言模型 [XG9ZHSTG]
[watch-import] [ATTACH] PDF linked for XG9ZHSTG
[watch-import] [SKIP] duplicate From Code Foundation Models to Agents and Applications: A Practical Guide to Cod (arxiv:2511.18538)
[watch-import] [SKIP] duplicate DeepSeek-V3.2: Pushing the Frontier of Open Large Language Models (arxiv:2512.02556)
[watch-import] [SKIP] duplicate DAComp: Benchmarking Data Agents across the Full Data Intelligence Lifecycle (arxiv:2512.04324)
[watch-import] [ADD] 4D-RGPT: Toward Region-level 4D Understanding via Perceptual Distillation → large_language_model｜大语言模型 [T4R5JQIT]
[watch-import] [ATTACH] PDF linked for T4R5JQIT
[watch-import] [SKIP] duplicate Step-GUI Technical Report (arxiv:2512.15431)
[watch-import] [TAG] foundation_model 'foundation_model｜基础模型' keywords=4
[watch-import] [HF] foundation_model matched 6 trending papers.
[watch-import] [HF-OVERRIDE] Added 'MMGR: Multi-Modal Generative Reasoning' despite score=0.28
[watch-import] [HF-OVERRIDE] Added 'Memory in the Age of AI Agents' despite score=0.27
[watch-import] [SCORE] tag=foundation_model total=6 selected=4
[watch-import] [COL] ensured collection 'foundation_model｜基础模型' → XHCMX3G4
[watch-import] [SKIP] duplicate From Code Foundation Models to Agents and Applications: A Practical Guide to Cod (arxiv:2511.18538)
[watch-import] [SKIP] duplicate Z-Image: An Efficient Image Generation Foundation Model with Single-Stream Diffu (arxiv:2511.22699)
[watch-import] [SKIP] duplicate MMGR: Multi-Modal Generative Reasoning (arxiv:2512.14691)
[watch-import] [SKIP] duplicate Memory in the Age of AI Agents (arxiv:2512.13564)
[watch-import] [TAG] dexterous_hand 'dexterous_hand｜灵巧机械手' keywords=4
[watch-import] [SCORE] tag=dexterous_hand total=0 selected=0
[watch-import] [TAG] humanoid_robot 'humanoid_robot｜类人机器人' keywords=4
[watch-import] [HF] humanoid_robot matched 1 trending papers.
[watch-import] [HF-OVERRIDE] Added 'Step-GUI Technical Report' despite score=0.29
[watch-import] [SCORE] tag=humanoid_robot total=1 selected=1
[watch-import] [COL] ensured collection 'humanoid_robot｜类人机器人' → B652AA82
[watch-import] [SKIP] duplicate Step-GUI Technical Report (arxiv:2512.15431)
[watch-import] [TAG] quadruped_robot 'quadruped_robot｜四足机器人' keywords=3
[watch-import] [SCORE] tag=quadruped_robot total=0 selected=0
[watch-import] [TAG] robotic_arm 'robotic_arm｜机械臂' keywords=3
[watch-import] [SCORE] tag=robotic_arm total=0 selected=0
[watch-import] [TAG] reinforcement_learning 'reinforcement_learning｜强化学习' keywords=4
[watch-import] [HF] reinforcement_learning matched 36 trending papers.
[watch-import] [HF-OVERRIDE] Added 'Step-GUI Technical Report' despite score=0.29
[watch-import] [HF-OVERRIDE] Added 'When Reasoning Meets Its Laws' despite score=0.28
[watch-import] [SCORE] tag=reinforcement_learning total=36 selected=9
[watch-import] [COL] ensured collection 'reinforcement_learning｜强化学习' → 8S3SWIMS
[watch-import] [SKIP] duplicate Seed-Prover 1.5: Mastering Undergraduate-Level Theorem Proving via Learning from (arxiv:2512.17260)
[watch-import] [SKIP] duplicate From Code Foundation Models to Agents and Applications: A Practical Guide to Cod (arxiv:2511.18538)
[watch-import] [SKIP] duplicate DeepSeek-V3.2: Pushing the Frontier of Open Large Language Models (arxiv:2512.02556)
[watch-import] [SKIP] duplicate LongVT: Incentivizing "Thinking with Long Videos" via Native Tool Calling (arxiv:2511.20785)
[watch-import] [SKIP] duplicate DAComp: Benchmarking Data Agents across the Full Data Intelligence Lifecycle (arxiv:2512.04324)
[watch-import] [SKIP] duplicate Kling-Omni Technical Report (arxiv:2512.16776)
[watch-import] [SKIP] duplicate Qwen3-VL Technical Report (arxiv:2511.21631)
[watch-import] [SKIP] duplicate Step-GUI Technical Report (arxiv:2512.15431)
[watch-import] [ADD] When Reasoning Meets Its Laws → reinforcement_learning｜强化学习 [GKWEP92R]
[watch-import] [ATTACH] PDF linked for GKWEP92R
[watch-import] [TAG] imitation_learning 'imitation_learning｜模仿学习' keywords=5
[watch-import] [SCORE] tag=imitation_learning total=0 selected=0
[watch-import] [TAG] world_model 'world_model｜世界模型' keywords=4
[watch-import] [HF] world_model matched 4 trending papers.
[watch-import] [HF-OVERRIDE] Added 'MMGR: Multi-Modal Generative Reasoning' despite score=0.28
[watch-import] [HF-OVERRIDE] Added 'Envision: Benchmarking Unified Understanding & Generation for Causal World Proce' despite score=0.23
[watch-import] [SCORE] tag=world_model total=4 selected=2
[watch-import] [COL] ensured collection 'world_model｜世界模型' → 4R62EWKD
[watch-import] [SKIP] duplicate MMGR: Multi-Modal Generative Reasoning (arxiv:2512.14691)
[watch-import] [SKIP] duplicate Envision: Benchmarking Unified Understanding & Generation for Causal World Proce (arxiv:2512.01816)
[watch-import] [TAG] simulator 'simulator｜仿真平台' keywords=5
[watch-import] [HF] simulator matched 2 trending papers.
[watch-import] [HF-OVERRIDE] Added 'MMGR: Multi-Modal Generative Reasoning' despite score=0.28
[watch-import] [SCORE] tag=simulator total=2 selected=2
[watch-import] [COL] ensured collection 'simulator｜仿真平台' → KNGFHIMG
[watch-import] [SKIP] duplicate Kling-Omni Technical Report (arxiv:2512.16776)
[watch-import] [SKIP] duplicate MMGR: Multi-Modal Generative Reasoning (arxiv:2512.14691)
[watch-import] [TAG] motion_planning 'motion_planning｜运动规划' keywords=4
[watch-import] [SCORE] tag=motion_planning total=0 selected=0
[watch-import] [TAG] task_planning 'task_planning｜任务规划' keywords=4
[watch-import] [SCORE] tag=task_planning total=0 selected=0
[watch-import] [TAG] code_based_task_planning 'code_based_task_planning｜代码任务规划' keywords=4
[watch-import] [SCORE] tag=code_based_task_planning total=0 selected=0
[watch-import] [TAG] language_based_task_planning 'language_based_task_planning｜语言任务规划' keywords=3
[watch-import] [SCORE] tag=language_based_task_planning total=0 selected=0
[watch-import] [TAG] end_to_end_task_planning 'end_to_end_task_planning｜端到端任务规划' keywords=3
[watch-import] [SCORE] tag=end_to_end_task_planning total=0 selected=0
[watch-import] [TAG] grounded_task_planning 'grounded_task_planning｜具身语义任务规划' keywords=3
[watch-import] [SCORE] tag=grounded_task_planning total=0 selected=0
[watch-import] [TAG] transformer_policy 'transformer_policy｜Transformer控制策略' keywords=4
[watch-import] [SCORE] tag=transformer_policy total=0 selected=0
[watch-import] [TAG] diffusion_policy 'diffusion_policy｜扩散策略学习' keywords=3
[watch-import] [SCORE] tag=diffusion_policy total=0 selected=0
[watch-import] [TAG] 3d_vision '3d_vision｜3D视觉感知' keywords=4
[watch-import] [SCORE] tag=3d_vision total=0 selected=0
[watch-import] [TAG] point_based_action 'point_based_action｜基于点的控制' keywords=4
[watch-import] [SCORE] tag=point_based_action total=0 selected=0
[watch-import] [TAG] chain_of_thought 'chain_of_thought｜链式推理' keywords=4
[watch-import] [SCORE] tag=chain_of_thought total=0 selected=0
[watch-import] [INFO] Recorded 4 new items → /Users/neoone/code/Zotero/.data/new_items_watch.json
[watch-import] [INFO] Done. Summary: {"candidates": 4, "added": 4, "skipped": 28, "updated": 0, "hf_candidates": 87, "hf_overrides": 17}
[watch-import] [INFO] Report → /Users/neoone/code/Zotero/reports/watch_20251222_104117.json
[PIPELINE] ✓ watch completed
[PIPELINE] → pdf: since_hours=24.0 limit=∞
[fetch-pdfs] [TRY] QRQ3QTIJ ← existing attachment link: https://arxiv.org/pdf/2512.16301.pdf
[fetch-pdfs] [OK] Linked local PDF for QRQ3QTIJ
[fetch-pdfs] [TRY] XG9ZHSTG ← existing attachment link: https://arxiv.org/pdf/2512.17260.pdf
[fetch-pdfs] [OK] Linked local PDF for XG9ZHSTG
[fetch-pdfs] [TRY] T4R5JQIT ← existing attachment link: https://arxiv.org/pdf/2512.17012.pdf
[fetch-pdfs] [OK] Linked local PDF for T4R5JQIT
[fetch-pdfs] [TRY] GKWEP92R ← existing attachment link: https://arxiv.org/pdf/2512.17901.pdf
[fetch-pdfs] [OK] Linked local PDF for GKWEP92R
[fetch-pdfs] [INFO] Item FQS3886E already has local PDF attachments; skipping.
[fetch-pdfs] [INFO] Item 9J684JG9 already has local PDF attachments; skipping.
[fetch-pdfs] [INFO] Completed. PDFs added: 4, remaining without PDF: 0.
[PIPELINE] ✓ pdf completed
[PIPELINE] → dedupe: limit=∞ since_hours=24.0
[dedupe] [INFO] Scanned 6 top-level items (after time filter).
[dedupe] [INFO] No duplicates detected with the current heuristic.
[PIPELINE] ✓ dedupe completed
[PIPELINE] → summary: limit=200 since_hours=24.0
[summaries] [INFO] Fetched 200 Zotero items before time-window filtering.
[summaries] [INFO] 20 items remain after applying modified-since 24.0h window.
[summaries] [INFO] Processing When_Reasoning_Meets_Its_Laws.pdf (SNV2SMJP)
[summaries]   - Reading When_Reasoning_Meets_Its_Laws.pdf
[summaries]     [OK] Note created.
[summaries] [INFO] Processing 4D-RGPT__Toward_Region-level_4D_Understanding_via_Perceptual_Distillation.pdf (QEQCMQRE)
[summaries]   - Reading 4D-RGPT__Toward_Region-level_4D_Understanding_via_Perceptual_Distillation.pdf
[summaries]     [OK] Note created.
[summaries] [INFO] Processing Seed-Prover_1.5__Mastering_Undergraduate-Level_Theorem_Proving_via_Learning_from.pdf (84M84ISR)
[summaries]   - Reading Seed-Prover_1.5__Mastering_Undergraduate-Level_Theorem_Proving_via_Learning_from.pdf
[summaries]     [OK] Note created.
[summaries] [INFO] Processing Adaptation_of_Agentic_AI.pdf (NC6HDBPR)
[summaries]   - Reading Adaptation_of_Agentic_AI.pdf
[summaries]     [OK] Note created.
[summaries] [INFO] Processing PDF (HN5KC7BG)
[summaries]     [SKIP] Existing AI总结 note found; skipping this item.
[summaries] [INFO] Processing When Reasoning Meets Its Laws (GKWEP92R)
[summaries]     [SKIP] Existing AI总结 note found; skipping this item.
[summaries] [INFO] Processing PDF (DFH734PC)
[summaries]     [SKIP] Existing AI总结 note found; skipping this item.
[summaries] [INFO] Processing 4D-RGPT: Toward Region-level 4D Understanding via Perceptual Distillation (T4R5JQIT)
[summaries]     [SKIP] Existing AI总结 note found; skipping this item.
[summaries] [INFO] Processing PDF (GKSCSC3F)
[summaries]     [SKIP] Existing AI总结 note found; skipping this item.
[summaries] [INFO] Processing Seed-Prover 1.5: Mastering Undergraduate-Level Theorem Proving via Learning from Experience (XG9ZHSTG)
[summaries]     [SKIP] Existing AI总结 note found; skipping this item.
[summaries] [INFO] Processing PDF (PG3645J9)
[summaries]     [SKIP] Existing AI总结 note found; skipping this item.
[summaries] [INFO] Processing Adaptation of Agentic AI (QRQ3QTIJ)
[summaries]     [SKIP] Existing AI总结 note found; skipping this item.
[summaries] [INFO] Processing C686VH8B (C686VH8B)
[summaries] [WARN] No local PDF attachments for C686VH8B; children types: none
[summaries] [INFO] Processing K3XU47ZG (K3XU47ZG)
[summaries] [WARN] No local PDF attachments for K3XU47ZG; children types: none
[summaries] [INFO] Processing Step-GUI_Technical_Report.pdf (GPK6ZJHM)
[summaries]     [SKIP] Existing AI总结 note found; skipping this item.
[summaries] [INFO] Processing Kling-Omni_Technical_Report.pdf (FWIKJRQK)
[summaries]     [SKIP] Existing AI总结 note found; skipping this item.
[summaries] [INFO] Processing PDF (A8CD59GA)
[summaries]     [SKIP] Existing AI总结 note found; skipping this item.
[summaries] [INFO] Processing Kling-Omni Technical Report (FQS3886E)
[summaries]     [SKIP] Existing AI总结 note found; skipping this item.
[summaries] [INFO] Processing PDF (PGZXS7NF)
[summaries]     [SKIP] Existing AI总结 note found; skipping this item.
[summaries] [INFO] Processing Step-GUI Technical Report (9J684JG9)
[summaries]     [SKIP] Existing AI总结 note found; skipping this item.
[summaries] [INFO] Completed. Items scanned: 20, notes created: 4.
[PIPELINE] ✓ summary completed
[PIPELINE] → abstracts: limit=∞ since_hours=24.0
[abstracts] [INFO] Completed. Items scanned: 1490, updated: 0, missing abstract after lookup: 0.
[PIPELINE] ✓ abstracts completed
[PIPELINE] → notion: limit=500 since_hours=24.0
[notion-sync] [ERR] Notion API error for 'When Reasoning Meets Its Laws': 400 Client Error: Bad Request for url: https://api.notion.com/v1/pages
[notion-sync] [ERR] Notion API error for '4D-RGPT: Toward Region-level 4D Understanding via Perceptual Distillation': 400 Client Error: Bad Request for url: https://api.notion.com/v1/pages
[notion-sync] [ERR] Notion API error for 'Seed-Prover 1.5: Mastering Undergraduate-Level Theorem Proving via Learning from': 400 Client Error: Bad Request for url: https://api.notion.com/v1/pages
[notion-sync] [ERR] Notion API error for 'Adaptation of Agentic AI': 400 Client Error: Bad Request for url: https://api.notion.com/v1/pages
[notion-sync] [ERR] Notion API error for 'Kling-Omni Technical Report': 400 Client Error: Bad Request for url: https://api.notion.com/v1/pages
[notion-sync] [ERR] Notion API error for 'Step-GUI Technical Report': 400 Client Error: Bad Request for url: https://api.notion.com/v1/pages
[notion-sync] [INFO] Completed. Scanned=6 created=0 updated=0
[PIPELINE] ✓ notion completed
{
  "watch": {
    "name": "watch-import",
    "command": [
      "/Users/neoone/miniconda3/bin/python",
      "/Users/neoone/code/Zotero/scripts/watch_and_import_papers.py",
      "--tags",
      "/Users/neoone/code/Zotero/tag.json",
      "--since-days",
      "0",
      "--since-hours",
      "24.0",
      "--top-k",
      "10",
      "--min-score",
      "0.3",
      "--log-file",
      "/Users/neoone/code/Zotero/logs/watch_20251222_104117.log",
      "--report-json",
      "/Users/neoone/code/Zotero/reports/watch_20251222_104117.json",
      "--create-collections"
    ],
    "artifacts": {
      "log": "/Users/neoone/code/Zotero/logs/watch_20251222_104117.log",
      "report": "/Users/neoone/code/Zotero/reports/watch_20251222_104117.json",
      "report_data": {
        "started_at": "2025-12-22T10:41:17.245628",
        "params": {
          "since_days": 0,
          "since_hours": 24.0,
          "top_k": 10,
          "min_score": 0.3,
          "create_collections": true,
          "fill_missing": false,
          "dry_run": false,
          "use_hf_papers": true,
          "hf_weight": 0.3
        },
        "tags": {
          "embodied_ai": {
            "label": "embodied_ai｜具身智能",
            "candidates": 0,
            "added": 0,
            "skipped": 0,
            "updated": 0,
            "hf_candidates": 0,
            "hf_overrides": 0
          },
          "embodied_surveys": {
            "label": "embodied_surveys｜具身智能综述",
            "candidates": 7,
            "added": 1,
            "skipped": 1,
            "updated": 0,
            "hf_candidates": 7,
            "hf_overrides": 2
          },
          "sim2real": {
            "label": "sim2real｜模拟到现实",
            "candidates": 0,
            "added": 0,
            "skipped": 0,
            "updated": 0,
            "hf_candidates": 0,
            "hf_overrides": 0
          },
          "teleoperation": {
            "label": "teleoperation｜遥操作",
            "candidates": 0,
            "added": 0,
            "skipped": 0,
            "updated": 0,
            "hf_candidates": 0,
            "hf_overrides": 0
          },
          "robotic_navigation": {
            "label": "robotic_navigation｜机器人导航",
            "candidates": 1,
            "added": 0,
            "skipped": 1,
            "updated": 0,
            "hf_candidates": 1,
            "hf_overrides": 1
          },
          "robotic_manipulation": {
            "label": "robotic_manipulation｜机器人操作",
            "candidates": 2,
            "added": 0,
            "skipped": 2,
            "updated": 0,
            "hf_candidates": 2,
            "hf_overrides": 2
          },
          "robotic_grasping": {
            "label": "robotic_grasping｜机器人抓取",
            "candidates": 0,
            "added": 0,
            "skipped": 0,
            "updated": 0,
            "hf_candidates": 0,
            "hf_overrides": 0
          },
          "vision_language_model": {
            "label": "vision_language_model｜视觉语言模型",
            "candidates": 4,
            "added": 0,
            "skipped": 3,
            "updated": 0,
            "hf_candidates": 4,
            "hf_overrides": 2
          },
          "vision_language_action_model": {
            "label": "vision_language_action_model｜视觉语言动作模型",
            "candidates": 0,
            "added": 0,
            "skipped": 0,
            "updated": 0,
            "hf_candidates": 0,
            "hf_overrides": 0
          },
          "large_language_model": {
            "label": "large_language_model｜大语言模型",
            "candidates": 24,
            "added": 2,
            "skipped": 4,
            "updated": 0,
            "hf_candidates": 24,
            "hf_overrides": 2
          },
          "foundation_model": {
            "label": "foundation_model｜基础模型",
            "candidates": 6,
            "added": 0,
            "skipped": 4,
            "updated": 0,
            "hf_candidates": 6,
            "hf_overrides": 2
          },
          "dexterous_hand": {
            "label": "dexterous_hand｜灵巧机械手",
            "candidates": 0,
            "added": 0,
            "skipped": 0,
            "updated": 0,
            "hf_candidates": 0,
            "hf_overrides": 0
          },
          "humanoid_robot": {
            "label": "humanoid_robot｜类人机器人",
            "candidates": 1,
            "added": 0,
            "skipped": 1,
            "updated": 0,
            "hf_candidates": 1,
            "hf_overrides": 1
          },
          "quadruped_robot": {
            "label": "quadruped_robot｜四足机器人",
            "candidates": 0,
            "added": 0,
            "skipped": 0,
            "updated": 0,
            "hf_candidates": 0,
            "hf_overrides": 0
          },
          "robotic_arm": {
            "label": "robotic_arm｜机械臂",
            "candidates": 0,
            "added": 0,
            "skipped": 0,
            "updated": 0,
            "hf_candidates": 0,
            "hf_overrides": 0
          },
          "reinforcement_learning": {
            "label": "reinforcement_learning｜强化学习",
            "candidates": 36,
            "added": 1,
            "skipped": 8,
            "updated": 0,
            "hf_candidates": 36,
            "hf_overrides": 2
          },
          "imitation_learning": {
            "label": "imitation_learning｜模仿学习",
            "candidates": 0,
            "added": 0,
            "skipped": 0,
            "updated": 0,
            "hf_candidates": 0,
            "hf_overrides": 0
          },
          "world_model": {
            "label": "world_model｜世界模型",
            "candidates": 4,
            "added": 0,
            "skipped": 2,
            "updated": 0,
            "hf_candidates": 4,
            "hf_overrides": 2
          },
          "simulator": {
            "label": "simulator｜仿真平台",
            "candidates": 2,
            "added": 0,
            "skipped": 2,
            "updated": 0,
            "hf_candidates": 2,
            "hf_overrides": 1
          },
          "motion_planning": {
            "label": "motion_planning｜运动规划",
            "candidates": 0,
            "added": 0,
            "skipped": 0,
            "updated": 0,
            "hf_candidates": 0,
            "hf_overrides": 0
          },
          "task_planning": {
            "label": "task_planning｜任务规划",
            "candidates": 0,
            "added": 0,
            "skipped": 0,
            "updated": 0,
            "hf_candidates": 0,
            "hf_overrides": 0
          },
          "code_based_task_planning": {
            "label": "code_based_task_planning｜代码任务规划",
            "candidates": 0,
            "added": 0,
            "skipped": 0,
            "updated": 0,
            "hf_candidates": 0,
            "hf_overrides": 0
          },
          "language_based_task_planning": {
            "label": "language_based_task_planning｜语言任务规划",
            "candidates": 0,
            "added": 0,
            "skipped": 0,
            "updated": 0,
            "hf_candidates": 0,
            "hf_overrides": 0
          },
          "end_to_end_task_planning": {
            "label": "end_to_end_task_planning｜端到端任务规划",
            "candidates": 0,
            "added": 0,
            "skipped": 0,
            "updated": 0,
            "hf_candidates": 0,
            "hf_overrides": 0
          },
          "grounded_task_planning": {
            "label": "grounded_task_planning｜具身语义任务规划",
            "candidates": 0,
            "added": 0,
            "skipped": 0,
            "updated": 0,
            "hf_candidates": 0,
            "hf_overrides": 0
          },
          "transformer_policy": {
            "label": "transformer_policy｜Transformer控制策略",
            "candidates": 0,
            "added": 0,
            "skipped": 0,
            "updated": 0,
            "hf_candidates": 0,
            "hf_overrides": 0
          },
          "diffusion_policy": {
            "label": "diffusion_policy｜扩散策略学习",
            "candidates": 0,
            "added": 0,
            "skipped": 0,
            "updated": 0,
            "hf_candidates": 0,
            "hf_overrides": 0
          },
          "3d_vision": {
            "label": "3d_vision｜3D视觉感知",
            "candidates": 0,
            "added": 0,
            "skipped": 0,
            "updated": 0,
            "hf_candidates": 0,
            "hf_overrides": 0
          },
          "point_based_action": {
            "label": "point_based_action｜基于点的控制",
            "candidates": 0,
            "added": 0,
            "skipped": 0,
            "updated": 0,
            "hf_candidates": 0,
            "hf_overrides": 0
          },
          "chain_of_thought": {
            "label": "chain_of_thought｜链式推理",
            "candidates": 0,
            "added": 0,
            "skipped": 0,
            "updated": 0,
            "hf_candidates": 0,
            "hf_overrides": 0
          }
        },
        "summary": {
          "candidates": 4,
          "added": 4,
          "skipped": 28,
          "updated": 0,
          "hf_candidates": 87,
          "hf_overrides": 17
        },
        "errors": [],
        "hf_sources": {
          "daily": 3,
          "weekly": 3,
          "monthly": 50
        },
        "finished_at": "2025-12-22T10:45:17.856896"
      }
    }
  },
  "pdf": {
    "name": "fetch-pdfs",
    "command": [
      "/Users/neoone/miniconda3/bin/python",
      "/Users/neoone/code/Zotero/scripts/fetch_missing_pdfs.py",
      "--since-hours",
      "24.0",
      "--new-items-json",
      "/Users/neoone/code/Zotero/.data/new_items_watch.json"
    ],
    "artifacts": {}
  },
  "dedupe": {
    "name": "dedupe",
    "command": [
      "/Users/neoone/miniconda3/bin/python",
      "/Users/neoone/code/Zotero/scripts/merge_zotero_duplicates.py",
      "--group-by",
      "auto",
      "--modified-since-hours",
      "24.0"
    ],
    "artifacts": {}
  },
  "summary": {
    "name": "summaries",
    "command": [
      "/Users/neoone/miniconda3/bin/python",
      "/Users/neoone/code/Zotero/scripts/summarize_zotero_with_doubao.py",
      "--limit",
      "200",
      "--max-pages",
      "80",
      "--max-chars",
      "80000",
      "--note-tag",
      "AI总结",
      "--summary-dir",
      "/Users/neoone/code/Zotero/summaries",
      "--recursive",
      "--insert-note",
      "--modified-since-hours",
      "24.0"
    ],
    "artifacts": {
      "summary_dir": "/Users/neoone/code/Zotero/summaries"
    }
  },
  "abstract": {
    "name": "abstracts",
    "command": [
      "/Users/neoone/miniconda3/bin/python",
      "/Users/neoone/code/Zotero/scripts/enrich_zotero_abstracts.py",
      "--modified-since-hours",
      "24.0"
    ],
    "artifacts": {}
  },
  "notion": {
    "name": "notion-sync",
    "command": [
      "/Users/neoone/miniconda3/bin/python",
      "/Users/neoone/code/Zotero/scripts/sync_zotero_to_notion.py",
      "--limit",
      "500",
      "--tag-file",
      "/Users/neoone/code/Zotero/tag.json",
      "--recursive",
      "--skip-untitled",
      "--enrich-with-doubao",
      "--since-hours",
      "24.0"
    ],
    "artifacts": {}
  }
}
