[PIPELINE] → watch: since_hours=24.0 top_k=10 min_score=0.3
[watch-import] [INFO] Started watch. since_hours=24.0 (→ days=1.00) top_k=10 min_score=0.3
[watch-import] [HF] daily fetched=5 from date/2025-12-25
[watch-import] [HF] weekly fetched=20 from week/2025-W52
[watch-import] [HF] monthly fetched=50 from month/2025-12
[watch-import] [INFO] Building library index for dedupe...
[watch-import] [INFO] Library index sizes: DOI=101 arXiv=1162 URL=1406 TY=1383
[watch-import] [TAG] embodied_ai 'embodied_ai｜具身智能' keywords=5
[watch-import] [SCORE] tag=embodied_ai total=0 selected=0
[watch-import] [TAG] embodied_surveys 'embodied_surveys｜具身智能综述' keywords=9
[watch-import] [HF] embodied_surveys matched 5 trending papers.
[watch-import] [HF-OVERRIDE] Added 'Memory in the Age of AI Agents' despite score=0.25
[watch-import] [HF-OVERRIDE] Added 'Adaptation of Agentic AI' despite score=0.21
[watch-import] [SCORE] tag=embodied_surveys total=30 selected=2
[watch-import] [COL] ensured collection 'embodied_surveys｜具身智能综述' → DMRQPHFK
[watch-import] [SKIP] duplicate Memory in the Age of AI Agents (arxiv:2512.13564)
[watch-import] [SKIP] duplicate Adaptation of Agentic AI (arxiv:2512.16301)
[watch-import] [TAG] sim2real 'sim2real｜模拟到现实' keywords=5
[watch-import] [SCORE] tag=sim2real total=0 selected=0
[watch-import] [TAG] teleoperation 'teleoperation｜遥操作' keywords=5
[watch-import] [SCORE] tag=teleoperation total=1 selected=0
[watch-import] [TAG] robotic_navigation 'robotic_navigation｜机器人导航' keywords=5
[watch-import] [HF] robotic_navigation matched 3 trending papers.
[watch-import] [HF-OVERRIDE] Added 'QwenLong-L1.5: Post-Training Recipe for Long-Context Reasoning and Memory Manage' despite score=0.23
[watch-import] [HF-OVERRIDE] Added 'Bottom-up Policy Optimization: Your Language Model Policy Secretly Contains Inte' despite score=0.20
[watch-import] [SCORE] tag=robotic_navigation total=41 selected=2
[watch-import] [COL] ensured collection 'robotic_navigation｜机器人导航' → MCGEU54N
[watch-import] [SKIP] duplicate QwenLong-L1.5: Post-Training Recipe for Long-Context Reasoning and Memory Manage (arxiv:2512.12967)
[watch-import] [ADD] Bottom-up Policy Optimization: Your Language Model Policy Secretly Contains Inte → robotic_navigation｜机器人导航 [TSNUS94M]
[watch-import] [ATTACH] PDF linked for TSNUS94M
[watch-import] [TAG] robotic_manipulation 'robotic_manipulation｜机器人操作' keywords=5
[watch-import] [SCORE] tag=robotic_manipulation total=14 selected=0
[watch-import] [TAG] robotic_grasping 'robotic_grasping｜机器人抓取' keywords=5
[watch-import] [SCORE] tag=robotic_grasping total=0 selected=0
[watch-import] [TAG] vision_language_model 'vision_language_model｜视觉语言模型' keywords=5
[watch-import] [HF] vision_language_model matched 5 trending papers.
[watch-import] [HF-OVERRIDE] Added 'PhysBrain: Human Egocentric Data as a Bridge from Vision Language Models to Phys' despite score=0.27
[watch-import] [HF-OVERRIDE] Added 'PhysBrain: Human Egocentric Data as a Bridge from Vision Language Models to Phys' despite score=0.13
[watch-import] [SCORE] tag=vision_language_model total=21 selected=3
[watch-import] [COL] ensured collection 'vision_language_model｜视觉语言模型' → QVF9KXGQ
[watch-import] [SKIP] duplicate Qwen3-VL Technical Report (arxiv:2511.21631)
[watch-import] [ADD] PhysBrain: Human Egocentric Data as a Bridge from Vision Language Models to Phys → vision_language_model｜视觉语言模型 [B5GHZQTD]
[watch-import] [ATTACH] PDF linked for B5GHZQTD
[watch-import] [SKIP] duplicate PhysBrain: Human Egocentric Data as a Bridge from Vision Language Models to Phys (arxiv:2512.16793)
[watch-import] [TAG] vision_language_action_model 'vision_language_action_model｜视觉语言动作模型' keywords=4
[watch-import] [HF] vision_language_action_model matched 2 trending papers.
[watch-import] [HF-OVERRIDE] Added 'PhysBrain: Human Egocentric Data as a Bridge from Vision Language Models to Phys' despite score=0.27
[watch-import] [HF-OVERRIDE] Added 'PhysBrain: Human Egocentric Data as a Bridge from Vision Language Models to Phys' despite score=0.13
[watch-import] [SCORE] tag=vision_language_action_model total=4 selected=2
[watch-import] [COL] ensured collection 'vision_language_action_model｜视觉语言动作模型' → QXJMF6GC
[watch-import] [SKIP] duplicate PhysBrain: Human Egocentric Data as a Bridge from Vision Language Models to Phys (arxiv:2512.16793)
[watch-import] [SKIP] duplicate PhysBrain: Human Egocentric Data as a Bridge from Vision Language Models to Phys (arxiv:2512.16793)
[watch-import] [TAG] large_language_model 'large_language_model｜大语言模型' keywords=4
[watch-import] [HF] large_language_model matched 37 trending papers.
[watch-import] [HF-OVERRIDE] Added 'T2AV-Compass: Towards Unified Evaluation for Text-to-Audio-Video Generation' despite score=0.25
[watch-import] [SCORE] tag=large_language_model total=86 selected=1
[watch-import] [COL] ensured collection 'large_language_model｜大语言模型' → 2M7PTRS5
[watch-import] [ADD] T2AV-Compass: Towards Unified Evaluation for Text-to-Audio-Video Generation → large_language_model｜大语言模型 [GJWXKGWC]
[watch-import] [ATTACH] PDF linked for GJWXKGWC
[watch-import] [TAG] foundation_model 'foundation_model｜基础模型' keywords=4
[watch-import] [HF] foundation_model matched 5 trending papers.
[watch-import] [HF-OVERRIDE] Added 'MMGR: Multi-Modal Generative Reasoning' despite score=0.28
[watch-import] [HF-OVERRIDE] Added 'Memory in the Age of AI Agents' despite score=0.25
[watch-import] [SCORE] tag=foundation_model total=5 selected=4
[watch-import] [COL] ensured collection 'foundation_model｜基础模型' → XHCMX3G4
[watch-import] [SKIP] duplicate Z-Image: An Efficient Image Generation Foundation Model with Single-Stream Diffu (arxiv:2511.22699)
[watch-import] [SKIP] duplicate From Code Foundation Models to Agents and Applications: A Practical Guide to Cod (arxiv:2511.18538)
[watch-import] [SKIP] duplicate MMGR: Multi-Modal Generative Reasoning (arxiv:2512.14691)
[watch-import] [SKIP] duplicate Memory in the Age of AI Agents (arxiv:2512.13564)
[watch-import] [TAG] dexterous_hand 'dexterous_hand｜灵巧机械手' keywords=4
[watch-import] [SCORE] tag=dexterous_hand total=0 selected=0
[watch-import] [TAG] humanoid_robot 'humanoid_robot｜类人机器人' keywords=4
[watch-import] [HF] humanoid_robot matched 3 trending papers.
[watch-import] [HF-OVERRIDE] Added 'Step-GUI Technical Report' despite score=0.28
[watch-import] [HF-OVERRIDE] Added 'PhysBrain: Human Egocentric Data as a Bridge from Vision Language Models to Phys' despite score=0.27
[watch-import] [SCORE] tag=humanoid_robot total=4 selected=2
[watch-import] [COL] ensured collection 'humanoid_robot｜类人机器人' → B652AA82
[watch-import] [SKIP] duplicate Step-GUI Technical Report (arxiv:2512.15431)
[watch-import] [SKIP] duplicate PhysBrain: Human Egocentric Data as a Bridge from Vision Language Models to Phys (arxiv:2512.16793)
[watch-import] [TAG] quadruped_robot 'quadruped_robot｜四足机器人' keywords=3
[watch-import] [SCORE] tag=quadruped_robot total=0 selected=0
[watch-import] [TAG] robotic_arm 'robotic_arm｜机械臂' keywords=3
[watch-import] [SCORE] tag=robotic_arm total=0 selected=0
[watch-import] [TAG] reinforcement_learning 'reinforcement_learning｜强化学习' keywords=4
[watch-import] [HF] reinforcement_learning matched 49 trending papers.
[watch-import] [HF-OVERRIDE] Added 'Probing Scientific General Intelligence of LLMs with Scientist-Aligned Workflows' despite score=0.30
[watch-import] [HF-OVERRIDE] Added 'Qwen3-VL Technical Report' despite score=0.30
[watch-import] [SCORE] tag=reinforcement_learning total=54 selected=9
[watch-import] [COL] ensured collection 'reinforcement_learning｜强化学习' → 8S3SWIMS
[watch-import] [ADD] DataFlow: An LLM-Driven Framework for Unified Data Preparation and Workflow Auto → reinforcement_learning｜强化学习 [NH26BBZ5]
[watch-import] [ATTACH] PDF linked for NH26BBZ5
[watch-import] [SKIP] duplicate From Code Foundation Models to Agents and Applications: A Practical Guide to Cod (arxiv:2511.18538)
[watch-import] [SKIP] duplicate DeepSeek-V3.2: Pushing the Frontier of Open Large Language Models (arxiv:2512.02556)
[watch-import] [SKIP] duplicate DataFlow: An LLM-Driven Framework for Unified Data Preparation and Workflow Auto (arxiv:2512.16676)
[watch-import] [SKIP] duplicate Kling-Omni Technical Report (arxiv:2512.16776)
[watch-import] [SKIP] duplicate LongVT: Incentivizing "Thinking with Long Videos" via Native Tool Calling (arxiv:2511.20785)
[watch-import] [SKIP] duplicate DAComp: Benchmarking Data Agents across the Full Data Intelligence Lifecycle (arxiv:2512.04324)
[watch-import] [ADD] Probing Scientific General Intelligence of LLMs with Scientist-Aligned Workflows → reinforcement_learning｜强化学习 [H38VNVVA]
[watch-import] [ATTACH] PDF linked for H38VNVVA
[watch-import] [SKIP] duplicate Qwen3-VL Technical Report (arxiv:2511.21631)
[watch-import] [TAG] imitation_learning 'imitation_learning｜模仿学习' keywords=5
[watch-import] [SCORE] tag=imitation_learning total=0 selected=0
[watch-import] [TAG] world_model 'world_model｜世界模型' keywords=4
[watch-import] [HF] world_model matched 4 trending papers.
[watch-import] [HF-OVERRIDE] Added 'MMGR: Multi-Modal Generative Reasoning' despite score=0.28
[watch-import] [HF-OVERRIDE] Added 'Envision: Benchmarking Unified Understanding & Generation for Causal World Proce' despite score=0.20
[watch-import] [SCORE] tag=world_model total=4 selected=2
[watch-import] [COL] ensured collection 'world_model｜世界模型' → 4R62EWKD
[watch-import] [SKIP] duplicate MMGR: Multi-Modal Generative Reasoning (arxiv:2512.14691)
[watch-import] [SKIP] duplicate Envision: Benchmarking Unified Understanding & Generation for Causal World Proce (arxiv:2512.01816)
[watch-import] [TAG] simulator 'simulator｜仿真平台' keywords=5
[watch-import] [HF] simulator matched 2 trending papers.
[watch-import] [HF-OVERRIDE] Added 'MMGR: Multi-Modal Generative Reasoning' despite score=0.28
[watch-import] [SCORE] tag=simulator total=49 selected=2
[watch-import] [COL] ensured collection 'simulator｜仿真平台' → KNGFHIMG
[watch-import] [SKIP] duplicate Kling-Omni Technical Report (arxiv:2512.16776)
[watch-import] [SKIP] duplicate MMGR: Multi-Modal Generative Reasoning (arxiv:2512.14691)
[watch-import] [TAG] motion_planning 'motion_planning｜运动规划' keywords=4
[watch-import] [HF] motion_planning matched 1 trending papers.
[watch-import] [HF-OVERRIDE] Added 'LoGoPlanner: Localization Grounded Navigation Policy with Metric-aware Visual Ge' despite score=0.02
[watch-import] [SCORE] tag=motion_planning total=1 selected=1
[watch-import] [COL] ensured collection 'motion_planning｜运动规划' → DGH39V7J
[watch-import] [ADD] LoGoPlanner: Localization Grounded Navigation Policy with Metric-aware Visual Ge → motion_planning｜运动规划 [GBRZ49ZN]
[watch-import] [ATTACH] PDF linked for GBRZ49ZN
[watch-import] [TAG] task_planning 'task_planning｜任务规划' keywords=4
[watch-import] [HF] task_planning matched 1 trending papers.
[watch-import] [HF-OVERRIDE] Added 'LoGoPlanner: Localization Grounded Navigation Policy with Metric-aware Visual Ge' despite score=0.02
[watch-import] [SCORE] tag=task_planning total=3 selected=1
[watch-import] [COL] ensured collection 'task_planning｜任务规划' → IDXJKRDJ
[watch-import] [SKIP] duplicate LoGoPlanner: Localization Grounded Navigation Policy with Metric-aware Visual Ge (arxiv:2512.19629)
[watch-import] [TAG] code_based_task_planning 'code_based_task_planning｜代码任务规划' keywords=4
[watch-import] [SCORE] tag=code_based_task_planning total=0 selected=0
[watch-import] [TAG] language_based_task_planning 'language_based_task_planning｜语言任务规划' keywords=3
[watch-import] [SCORE] tag=language_based_task_planning total=0 selected=0
[watch-import] [TAG] end_to_end_task_planning 'end_to_end_task_planning｜端到端任务规划' keywords=3
[watch-import] [SCORE] tag=end_to_end_task_planning total=0 selected=0
[watch-import] [TAG] grounded_task_planning 'grounded_task_planning｜具身语义任务规划' keywords=3
[watch-import] [SCORE] tag=grounded_task_planning total=0 selected=0
[watch-import] [TAG] transformer_policy 'transformer_policy｜Transformer控制策略' keywords=4
[watch-import] [SCORE] tag=transformer_policy total=0 selected=0
[watch-import] [TAG] diffusion_policy 'diffusion_policy｜扩散策略学习' keywords=3
[watch-import] [SCORE] tag=diffusion_policy total=0 selected=0
[watch-import] [TAG] 3d_vision '3d_vision｜3D视觉感知' keywords=4
[watch-import] [SCORE] tag=3d_vision total=0 selected=0
[watch-import] [TAG] point_based_action 'point_based_action｜基于点的控制' keywords=4
[watch-import] [SCORE] tag=point_based_action total=0 selected=0
[watch-import] [TAG] chain_of_thought 'chain_of_thought｜链式推理' keywords=4
[watch-import] [SCORE] tag=chain_of_thought total=0 selected=0
[watch-import] [INFO] Recorded 6 new items → /Users/neoone/code/Zotero/.data/new_items_watch.json
[watch-import] [INFO] Done. Summary: {"candidates": 6, "added": 6, "skipped": 25, "updated": 0, "hf_candidates": 117, "hf_overrides": 20}
[watch-import] [INFO] Report → /Users/neoone/code/Zotero/reports/watch_20251225_104822.json
[PIPELINE] ✓ watch completed
[PIPELINE] → pdf: since_hours=24.0 limit=∞
[fetch-pdfs] [TRY] TSNUS94M ← existing attachment link: https://arxiv.org/pdf/2512.19673.pdf
[fetch-pdfs] [OK] Linked local PDF for TSNUS94M
[fetch-pdfs] [TRY] B5GHZQTD ← existing attachment link: https://arxiv.org/pdf/2512.16793.pdf
[fetch-pdfs] [OK] Linked local PDF for B5GHZQTD
[fetch-pdfs] [TRY] GJWXKGWC ← existing attachment link: https://arxiv.org/pdf/2512.21094.pdf
[fetch-pdfs] [OK] Linked local PDF for GJWXKGWC
[fetch-pdfs] [TRY] NH26BBZ5 ← existing attachment link: https://arxiv.org/pdf/2512.16676.pdf
[fetch-pdfs] [OK] Linked local PDF for NH26BBZ5
[fetch-pdfs] [TRY] H38VNVVA ← existing attachment link: https://arxiv.org/pdf/2512.16969.pdf
[fetch-pdfs] [OK] Linked local PDF for H38VNVVA
[fetch-pdfs] [TRY] GBRZ49ZN ← existing attachment link: https://arxiv.org/pdf/2512.19629.pdf
[fetch-pdfs] [OK] Linked local PDF for GBRZ49ZN
[fetch-pdfs] [INFO] Completed. PDFs added: 6, remaining without PDF: 0.
[PIPELINE] ✓ pdf completed
[PIPELINE] → dedupe: limit=∞ since_hours=24.0
[dedupe] [INFO] Scanned 6 top-level items (after time filter).
[dedupe] [INFO] No duplicates detected with the current heuristic.
[PIPELINE] ✓ dedupe completed
[PIPELINE] → summary: limit=200 since_hours=24.0
[summaries] [INFO] Fetched 200 Zotero items before time-window filtering.
[summaries] [INFO] 18 items remain after applying modified-since 24.0h window.
[summaries] [INFO] Processing LoGoPlanner__Localization_Grounded_Navigation_Policy_with_Metric-aware_Visual_Ge.pdf (EPC3QG7Z)
[summaries]   - Reading LoGoPlanner__Localization_Grounded_Navigation_Policy_with_Metric-aware_Visual_Ge.pdf
[summaries]     [OK] Note created.
[summaries] [INFO] Processing Probing_Scientific_General_Intelligence_of_LLMs_with_Scientist-Aligned_Workflows.pdf (XJ9KGHEJ)
[summaries]   - Reading Probing_Scientific_General_Intelligence_of_LLMs_with_Scientist-Aligned_Workflows.pdf
[summaries]     [OK] Note created.
[summaries] [INFO] Processing DataFlow__An_LLM-Driven_Framework_for_Unified_Data_Preparation_and_Workflow_Auto.pdf (6C56W783)
[summaries]   - Reading DataFlow__An_LLM-Driven_Framework_for_Unified_Data_Preparation_and_Workflow_Auto.pdf
[summaries]     [OK] Note created.
[summaries] [INFO] Processing T2AV-Compass__Towards_Unified_Evaluation_for_Text-to-Audio-Video_Generation.pdf (GXC4F3MI)
[summaries]   - Reading T2AV-Compass__Towards_Unified_Evaluation_for_Text-to-Audio-Video_Generation.pdf
[summaries]     [OK] Note created.
[summaries] [INFO] Processing PhysBrain__Human_Egocentric_Data_as_a_Bridge_from_Vision_Language_Models_to_Phys.pdf (3PKGWT4Z)
[summaries]   - Reading PhysBrain__Human_Egocentric_Data_as_a_Bridge_from_Vision_Language_Models_to_Phys.pdf
[summaries]     [OK] Note created.
[summaries] [INFO] Processing Bottom-up_Policy_Optimization__Your_Language_Model_Policy_Secretly_Contains_Inte.pdf (DDV2SA3V)
[summaries]   - Reading Bottom-up_Policy_Optimization__Your_Language_Model_Policy_Secretly_Contains_Inte.pdf
[summaries]     [OK] Note created.
[summaries] [INFO] Processing PDF (SITC6Z8Q)
[summaries]     [SKIP] Existing AI总结 note found; skipping this item.
[summaries] [INFO] Processing LoGoPlanner: Localization Grounded Navigation Policy with Metric-aware Visual Geometry (GBRZ49ZN)
[summaries]     [SKIP] Existing AI总结 note found; skipping this item.
[summaries] [INFO] Processing PDF (4BHSZ2MA)
[summaries]     [SKIP] Existing AI总结 note found; skipping this item.
[summaries] [INFO] Processing Probing Scientific General Intelligence of LLMs with Scientist-Aligned Workflows (H38VNVVA)
[summaries]     [SKIP] Existing AI总结 note found; skipping this item.
[summaries] [INFO] Processing PDF (EX2P4SPK)
[summaries]     [SKIP] Existing AI总结 note found; skipping this item.
[summaries] [INFO] Processing DataFlow: An LLM-Driven Framework for Unified Data Preparation and Workflow Automation in the Era of Data-Centric AI (NH26BBZ5)
[summaries]     [SKIP] Existing AI总结 note found; skipping this item.
[summaries] [INFO] Processing PDF (EU6T3QZW)
[summaries]     [SKIP] Existing AI总结 note found; skipping this item.
[summaries] [INFO] Processing T2AV-Compass: Towards Unified Evaluation for Text-to-Audio-Video Generation (GJWXKGWC)
[summaries]     [SKIP] Existing AI总结 note found; skipping this item.
[summaries] [INFO] Processing PDF (TUMEIGZI)
[summaries]     [SKIP] Existing AI总结 note found; skipping this item.
[summaries] [INFO] Processing PhysBrain: Human Egocentric Data as a Bridge from Vision Language Models to Physical Intelligence (B5GHZQTD)
[summaries]     [SKIP] Existing AI总结 note found; skipping this item.
[summaries] [INFO] Processing PDF (T84T7SFG)
[summaries]     [SKIP] Existing AI总结 note found; skipping this item.
[summaries] [INFO] Processing Bottom-up Policy Optimization: Your Language Model Policy Secretly Contains Internal Policies (TSNUS94M)
[summaries]     [SKIP] Existing AI总结 note found; skipping this item.
[summaries] [INFO] Completed. Items scanned: 18, notes created: 6.
[PIPELINE] ✓ summary completed
[PIPELINE] → abstracts: limit=∞ since_hours=24.0
[abstracts] [INFO] Completed. Items scanned: 1496, updated: 0, missing abstract after lookup: 0.
[PIPELINE] ✓ abstracts completed
[PIPELINE] → notion: limit=500 since_hours=24.0
[notion-sync] [ERR] Notion API error for 'LoGoPlanner: Localization Grounded Navigation Policy with Metric-aware Visual Ge': 400 Client Error: Bad Request for url: https://api.notion.com/v1/pages
[notion-sync] [ERR] Notion API error for 'Probing Scientific General Intelligence of LLMs with Scientist-Aligned Workflows': 400 Client Error: Bad Request for url: https://api.notion.com/v1/pages
[notion-sync] [ERR] Notion API error for 'DataFlow: An LLM-Driven Framework for Unified Data Preparation and Workflow Auto': 400 Client Error: Bad Request for url: https://api.notion.com/v1/pages
[notion-sync] [ERR] Notion API error for 'T2AV-Compass: Towards Unified Evaluation for Text-to-Audio-Video Generation': 400 Client Error: Bad Request for url: https://api.notion.com/v1/pages
[notion-sync] [ERR] Notion API error for 'PhysBrain: Human Egocentric Data as a Bridge from Vision Language Models to Phys': 400 Client Error: Bad Request for url: https://api.notion.com/v1/pages
[notion-sync] [ERR] Notion API error for 'Bottom-up Policy Optimization: Your Language Model Policy Secretly Contains Inte': 400 Client Error: Bad Request for url: https://api.notion.com/v1/pages
[notion-sync] [INFO] Completed. Scanned=6 created=0 updated=0
[PIPELINE] ✓ notion completed
{
  "watch": {
    "name": "watch-import",
    "command": [
      "/Users/neoone/miniconda3/bin/python",
      "/Users/neoone/code/Zotero/scripts/watch_and_import_papers.py",
      "--tags",
      "/Users/neoone/code/Zotero/tag.json",
      "--since-days",
      "0",
      "--since-hours",
      "24.0",
      "--top-k",
      "10",
      "--min-score",
      "0.3",
      "--log-file",
      "/Users/neoone/code/Zotero/logs/watch_20251225_104822.log",
      "--report-json",
      "/Users/neoone/code/Zotero/reports/watch_20251225_104822.json",
      "--create-collections"
    ],
    "artifacts": {
      "log": "/Users/neoone/code/Zotero/logs/watch_20251225_104822.log",
      "report": "/Users/neoone/code/Zotero/reports/watch_20251225_104822.json",
      "report_data": {
        "started_at": "2025-12-25T10:48:22.697390",
        "params": {
          "since_days": 0,
          "since_hours": 24.0,
          "top_k": 10,
          "min_score": 0.3,
          "create_collections": true,
          "fill_missing": false,
          "dry_run": false,
          "use_hf_papers": true,
          "hf_weight": 0.3
        },
        "tags": {
          "embodied_ai": {
            "label": "embodied_ai｜具身智能",
            "candidates": 0,
            "added": 0,
            "skipped": 0,
            "updated": 0,
            "hf_candidates": 0,
            "hf_overrides": 0
          },
          "embodied_surveys": {
            "label": "embodied_surveys｜具身智能综述",
            "candidates": 30,
            "added": 0,
            "skipped": 2,
            "updated": 0,
            "hf_candidates": 5,
            "hf_overrides": 2
          },
          "sim2real": {
            "label": "sim2real｜模拟到现实",
            "candidates": 0,
            "added": 0,
            "skipped": 0,
            "updated": 0,
            "hf_candidates": 0,
            "hf_overrides": 0
          },
          "teleoperation": {
            "label": "teleoperation｜遥操作",
            "candidates": 1,
            "added": 0,
            "skipped": 0,
            "updated": 0,
            "hf_candidates": 0,
            "hf_overrides": 0
          },
          "robotic_navigation": {
            "label": "robotic_navigation｜机器人导航",
            "candidates": 41,
            "added": 1,
            "skipped": 1,
            "updated": 0,
            "hf_candidates": 3,
            "hf_overrides": 2
          },
          "robotic_manipulation": {
            "label": "robotic_manipulation｜机器人操作",
            "candidates": 14,
            "added": 0,
            "skipped": 0,
            "updated": 0,
            "hf_candidates": 0,
            "hf_overrides": 0
          },
          "robotic_grasping": {
            "label": "robotic_grasping｜机器人抓取",
            "candidates": 0,
            "added": 0,
            "skipped": 0,
            "updated": 0,
            "hf_candidates": 0,
            "hf_overrides": 0
          },
          "vision_language_model": {
            "label": "vision_language_model｜视觉语言模型",
            "candidates": 21,
            "added": 1,
            "skipped": 2,
            "updated": 0,
            "hf_candidates": 5,
            "hf_overrides": 2
          },
          "vision_language_action_model": {
            "label": "vision_language_action_model｜视觉语言动作模型",
            "candidates": 4,
            "added": 0,
            "skipped": 2,
            "updated": 0,
            "hf_candidates": 2,
            "hf_overrides": 2
          },
          "large_language_model": {
            "label": "large_language_model｜大语言模型",
            "candidates": 86,
            "added": 1,
            "skipped": 0,
            "updated": 0,
            "hf_candidates": 37,
            "hf_overrides": 1
          },
          "foundation_model": {
            "label": "foundation_model｜基础模型",
            "candidates": 5,
            "added": 0,
            "skipped": 4,
            "updated": 0,
            "hf_candidates": 5,
            "hf_overrides": 2
          },
          "dexterous_hand": {
            "label": "dexterous_hand｜灵巧机械手",
            "candidates": 0,
            "added": 0,
            "skipped": 0,
            "updated": 0,
            "hf_candidates": 0,
            "hf_overrides": 0
          },
          "humanoid_robot": {
            "label": "humanoid_robot｜类人机器人",
            "candidates": 4,
            "added": 0,
            "skipped": 2,
            "updated": 0,
            "hf_candidates": 3,
            "hf_overrides": 2
          },
          "quadruped_robot": {
            "label": "quadruped_robot｜四足机器人",
            "candidates": 0,
            "added": 0,
            "skipped": 0,
            "updated": 0,
            "hf_candidates": 0,
            "hf_overrides": 0
          },
          "robotic_arm": {
            "label": "robotic_arm｜机械臂",
            "candidates": 0,
            "added": 0,
            "skipped": 0,
            "updated": 0,
            "hf_candidates": 0,
            "hf_overrides": 0
          },
          "reinforcement_learning": {
            "label": "reinforcement_learning｜强化学习",
            "candidates": 54,
            "added": 2,
            "skipped": 7,
            "updated": 0,
            "hf_candidates": 49,
            "hf_overrides": 2
          },
          "imitation_learning": {
            "label": "imitation_learning｜模仿学习",
            "candidates": 0,
            "added": 0,
            "skipped": 0,
            "updated": 0,
            "hf_candidates": 0,
            "hf_overrides": 0
          },
          "world_model": {
            "label": "world_model｜世界模型",
            "candidates": 4,
            "added": 0,
            "skipped": 2,
            "updated": 0,
            "hf_candidates": 4,
            "hf_overrides": 2
          },
          "simulator": {
            "label": "simulator｜仿真平台",
            "candidates": 49,
            "added": 0,
            "skipped": 2,
            "updated": 0,
            "hf_candidates": 2,
            "hf_overrides": 1
          },
          "motion_planning": {
            "label": "motion_planning｜运动规划",
            "candidates": 1,
            "added": 1,
            "skipped": 0,
            "updated": 0,
            "hf_candidates": 1,
            "hf_overrides": 1
          },
          "task_planning": {
            "label": "task_planning｜任务规划",
            "candidates": 3,
            "added": 0,
            "skipped": 1,
            "updated": 0,
            "hf_candidates": 1,
            "hf_overrides": 1
          },
          "code_based_task_planning": {
            "label": "code_based_task_planning｜代码任务规划",
            "candidates": 0,
            "added": 0,
            "skipped": 0,
            "updated": 0,
            "hf_candidates": 0,
            "hf_overrides": 0
          },
          "language_based_task_planning": {
            "label": "language_based_task_planning｜语言任务规划",
            "candidates": 0,
            "added": 0,
            "skipped": 0,
            "updated": 0,
            "hf_candidates": 0,
            "hf_overrides": 0
          },
          "end_to_end_task_planning": {
            "label": "end_to_end_task_planning｜端到端任务规划",
            "candidates": 0,
            "added": 0,
            "skipped": 0,
            "updated": 0,
            "hf_candidates": 0,
            "hf_overrides": 0
          },
          "grounded_task_planning": {
            "label": "grounded_task_planning｜具身语义任务规划",
            "candidates": 0,
            "added": 0,
            "skipped": 0,
            "updated": 0,
            "hf_candidates": 0,
            "hf_overrides": 0
          },
          "transformer_policy": {
            "label": "transformer_policy｜Transformer控制策略",
            "candidates": 0,
            "added": 0,
            "skipped": 0,
            "updated": 0,
            "hf_candidates": 0,
            "hf_overrides": 0
          },
          "diffusion_policy": {
            "label": "diffusion_policy｜扩散策略学习",
            "candidates": 0,
            "added": 0,
            "skipped": 0,
            "updated": 0,
            "hf_candidates": 0,
            "hf_overrides": 0
          },
          "3d_vision": {
            "label": "3d_vision｜3D视觉感知",
            "candidates": 0,
            "added": 0,
            "skipped": 0,
            "updated": 0,
            "hf_candidates": 0,
            "hf_overrides": 0
          },
          "point_based_action": {
            "label": "point_based_action｜基于点的控制",
            "candidates": 0,
            "added": 0,
            "skipped": 0,
            "updated": 0,
            "hf_candidates": 0,
            "hf_overrides": 0
          },
          "chain_of_thought": {
            "label": "chain_of_thought｜链式推理",
            "candidates": 0,
            "added": 0,
            "skipped": 0,
            "updated": 0,
            "hf_candidates": 0,
            "hf_overrides": 0
          }
        },
        "summary": {
          "candidates": 6,
          "added": 6,
          "skipped": 25,
          "updated": 0,
          "hf_candidates": 117,
          "hf_overrides": 20
        },
        "errors": [],
        "hf_sources": {
          "daily": 5,
          "weekly": 20,
          "monthly": 50
        },
        "finished_at": "2025-12-25T10:54:19.915447"
      }
    }
  },
  "pdf": {
    "name": "fetch-pdfs",
    "command": [
      "/Users/neoone/miniconda3/bin/python",
      "/Users/neoone/code/Zotero/scripts/fetch_missing_pdfs.py",
      "--since-hours",
      "24.0",
      "--new-items-json",
      "/Users/neoone/code/Zotero/.data/new_items_watch.json"
    ],
    "artifacts": {}
  },
  "dedupe": {
    "name": "dedupe",
    "command": [
      "/Users/neoone/miniconda3/bin/python",
      "/Users/neoone/code/Zotero/scripts/merge_zotero_duplicates.py",
      "--group-by",
      "auto",
      "--modified-since-hours",
      "24.0"
    ],
    "artifacts": {}
  },
  "summary": {
    "name": "summaries",
    "command": [
      "/Users/neoone/miniconda3/bin/python",
      "/Users/neoone/code/Zotero/scripts/summarize_zotero_with_doubao.py",
      "--limit",
      "200",
      "--max-pages",
      "80",
      "--max-chars",
      "80000",
      "--note-tag",
      "AI总结",
      "--summary-dir",
      "/Users/neoone/code/Zotero/summaries",
      "--recursive",
      "--insert-note",
      "--modified-since-hours",
      "24.0"
    ],
    "artifacts": {
      "summary_dir": "/Users/neoone/code/Zotero/summaries"
    }
  },
  "abstract": {
    "name": "abstracts",
    "command": [
      "/Users/neoone/miniconda3/bin/python",
      "/Users/neoone/code/Zotero/scripts/enrich_zotero_abstracts.py",
      "--modified-since-hours",
      "24.0"
    ],
    "artifacts": {}
  },
  "notion": {
    "name": "notion-sync",
    "command": [
      "/Users/neoone/miniconda3/bin/python",
      "/Users/neoone/code/Zotero/scripts/sync_zotero_to_notion.py",
      "--limit",
      "500",
      "--tag-file",
      "/Users/neoone/code/Zotero/tag.json",
      "--recursive",
      "--skip-untitled",
      "--enrich-with-doubao",
      "--since-hours",
      "24.0"
    ],
    "artifacts": {}
  }
}
